Title,Date,ID,Comment,Comment_date,Channel,Like,Dislike,Comment_like
#139​ 민주당 지도부가 2030 마음을 얻으려면...,실시간 스트리밍 시작일: 2021. 4. 8.,샤인디케이,"내리막이 있으면 다시 오르막이 있는 법, 예방주사라 생각하고 힘들 냅시다.",2주 전(수정됨),박시영TV,6.4천,83,48
#139​ 민주당 지도부가 2030 마음을 얻으려면...,실시간 스트리밍 시작일: 2021. 4. 8.,문동렬,2030마음을 얻으려면 조언을 2030을 모셔다가 들어보는 성의를 보여야 됩니다. 2030도 아닌사람들이 추측해서 2030의 마음을 이야기하는것 자체가 문제의식이 없는 것입니다. 아마추어라도 2030사람들을 몇번이라도 불러서 보여주며 실질적인 것을 들어보는 것이 좋다고 생각해요.,2주 전,박시영TV,6.4천,83,37
#139​ 민주당 지도부가 2030 마음을 얻으려면...,실시간 스트리밍 시작일: 2021. 4. 8.,135 swan,전 군대 전역 전까지는 보수를 지지했지만 대학에서 양극화에 관심을 가지면서 진보로 돌아섰죠! 20대의 경우 성격이 너무나 다르기에 초중반을나눠서 공략해야 한다고 생각해요! 가령 20대 초반이 등록금 같은게 문제라면 중반은 취업 후반은 자산 형성처럼(20~30대고민 혼재)세세하게 고민하는 흔적들을 보여주는게 중요하다고 생각합니다...정당 색채가 엷을 때는 사소한 이유로 지지정당이 변하는 경우가 많으니...,2주 전,박시영TV,6.4천,83,34
#139​ 민주당 지도부가 2030 마음을 얻으려면...,실시간 스트리밍 시작일: 2021. 4. 8.,미루,몸 안에서 무엇인가 무너져 내린 기분..그래도 힘내고 가야죠민주당은 뼈아픈 진단 새겨들어야 합니다황희두님 자주 함께해서 20-30대 남성들의 마음을 얻을 수 있는 방안도 모색해야 합니다.그리고 전국민 재난지원금 보편지급!!언론개혁!!,2주 전,박시영TV,6.4천,83,67
#139​ 민주당 지도부가 2030 마음을 얻으려면...,실시간 스트리밍 시작일: 2021. 4. 8.,단아란,네 죄송합니다. 삭제하겠습니다,2주 전(수정됨),박시영TV,6.4천,83,34
#139​ 민주당 지도부가 2030 마음을 얻으려면...,실시간 스트리밍 시작일: 2021. 4. 8.,권석민,진짜 민주당 제대로 각성해서 대권 화끈하게 가져오자!!!!!,2주 전,박시영TV,6.4천,83,45
#139​ 민주당 지도부가 2030 마음을 얻으려면...,실시간 스트리밍 시작일: 2021. 4. 8.,장브레송,당대표 후보들이 왜 그 모양이야? ㅠㅠ,2주 전,박시영TV,6.4천,83,11
#139​ 민주당 지도부가 2030 마음을 얻으려면...,실시간 스트리밍 시작일: 2021. 4. 8.,알파카,"말씀하신대로 열심히 2030 관련된 정책내고 입안하는거 중요하죠. 근데 그거 못지않게 중요한게 '홍보'입니다! 우리 이러이런거 만들었어 알아봐죠!가 아니라 커뮤니티 대응팀 만들어서 홍보좀 하라구요..2030들 커뮤니티 중독처럼 진짜 많이 합니다. 청와대나 당이나 홍보마케팅 전문가좀 잘 들여와서 커뮤니티 공략해야합니다. 그래야 지지자들이 또 퍼날르고 하죠. 포탈만큼 중요해요. 유튜브 sns도 물론 적극 활용하구요. 제발 법안, 정책 홍보좀 확실하게...진정성 있는것도 좋은데 쇼도 필요할때 해야죠. 커뮤니티에 관심 가지라고 꼭 당에 말씀 해주시고 박대표님 보실수있게 추천좀 부탁드려요ㅠ",2주 전(수정됨),박시영TV,6.4천,83,46
#139​ 민주당 지도부가 2030 마음을 얻으려면...,실시간 스트리밍 시작일: 2021. 4. 8.,준건이형,20대한테 참아라 노력하라 30대한테 견뎌라 그런말그만하고 소통하고 제발시원하게 개혁좀해라!,2주 전,박시영TV,6.4천,83,12
#139​ 민주당 지도부가 2030 마음을 얻으려면...,실시간 스트리밍 시작일: 2021. 4. 8.,Raina C.,"지난 1년동안 180석 가지고도 이리 X신 짓거리를 할 수도 있구나 하고 정말 뼈저리게 느꼈습니다.민주당은 180석의 자만에 빠져 국민들과 소통하는 눈과 귀를 다 닫은 거 같더군요.핑계거리는 그만 찾으시고 바뀌 십시오 지금 당장 당내 X맨과 수박들 싹 다 쳐내고 새롭게 시작하십시오. 초선 위원들 중심으로 그동안 지지부진 미뤄왔던 진정한 개혁 태풍을 한번 일으켜 보란 말입니다.",2주 전(수정됨),박시영TV,6.4천,83,16
#139​ 민주당 지도부가 2030 마음을 얻으려면...,실시간 스트리밍 시작일: 2021. 4. 8.,김정윤,계속 이길순없다.  아쉽지만 이번엔잘 졌다.,2주 전,박시영TV,6.4천,83,10
#139​ 민주당 지도부가 2030 마음을 얻으려면...,실시간 스트리밍 시작일: 2021. 4. 8.,Sunghee Lee,기운냅시다!!!^^ 박시영tv 화이팅!!! 👍👍👍,2주 전,박시영TV,6.4천,83,20
#139​ 민주당 지도부가 2030 마음을 얻으려면...,실시간 스트리밍 시작일: 2021. 4. 8.,김지혜,2030세대 맘을 꿰뚫어야 희망을 보이게 해야합니다,2주 전,박시영TV,6.4천,83,4
#139​ 민주당 지도부가 2030 마음을 얻으려면...,실시간 스트리밍 시작일: 2021. 4. 8.,우리터전,박시영tv  잘하고 계십니다~👍👏❤️,2주 전,박시영TV,6.4천,83,40
#139​ 민주당 지도부가 2030 마음을 얻으려면...,실시간 스트리밍 시작일: 2021. 4. 8.,Hoyun Nam,기운 냅시다,2주 전,박시영TV,6.4천,83,11
#139​ 민주당 지도부가 2030 마음을 얻으려면...,실시간 스트리밍 시작일: 2021. 4. 8.,푸른숲,넓게보지말고 지켜보지말고 깊게보지말고 180석가지고 행동하시라..제대로 법을 만들기를..,2주 전,박시영TV,6.4천,83,6
#139​ 민주당 지도부가 2030 마음을 얻으려면...,실시간 스트리밍 시작일: 2021. 4. 8.,Sue Kim,민생! 코로나로 지쳐있는 서민들에게 보편지급 돈 좀 풀었다면 ㅠ ㅠ,2주 전,박시영TV,6.4천,83,4
#139​ 민주당 지도부가 2030 마음을 얻으려면...,실시간 스트리밍 시작일: 2021. 4. 8.,김광호,힘냅시다 💙🇰🇷,2주 전,박시영TV,6.4천,83,3
#139​ 민주당 지도부가 2030 마음을 얻으려면...,실시간 스트리밍 시작일: 2021. 4. 8.,그럭저럭,협치는 불가합니다.  휘말려 들어갑니다,2주 전,박시영TV,6.4천,83,8
#139​ 민주당 지도부가 2030 마음을 얻으려면...,실시간 스트리밍 시작일: 2021. 4. 8.,DAL SOO JEONG,제일 큰 문제가 지금 말씀 하신 1가구 1주택 소유자 에 대한. 민심을 제대로 못 읽었다는게패인 서민 민심 세금!!,2주 전,박시영TV,6.4천,83,25
#139​ 민주당 지도부가 2030 마음을 얻으려면...,실시간 스트리밍 시작일: 2021. 4. 8.,최현정,엘시티 40억 부동산업자 강남30 억 부자들 이런 사람이 어찌 서민들 맘을 알까요? 서울 부산 심각합니다,2주 전,박시영TV,6.4천,83,28
#139​ 민주당 지도부가 2030 마음을 얻으려면...,실시간 스트리밍 시작일: 2021. 4. 8.,신혜진,"일일 공개 브리핑 완전 찬성!!! 이왕이면 얼굴 완전 되는 한준호 의원이 하면 진짜 좋을듯. 아나운서였으니 발음,전달력은 당연 좋구.",2주 전,박시영TV,6.4천,83,1
#139​ 민주당 지도부가 2030 마음을 얻으려면...,실시간 스트리밍 시작일: 2021. 4. 8.,together,오늘  일부러 티비 안봤는데,2주 전,박시영TV,6.4천,83,4
#139​ 민주당 지도부가 2030 마음을 얻으려면...,실시간 스트리밍 시작일: 2021. 4. 8.,롤링베어Vlog,당내에 부끄러운줄 모르고 설처대는 수박들 반듯시 처단해야함 지금 당장🍉🍉🍉🍉,2주 전,박시영TV,6.4천,83,3
#139​ 민주당 지도부가 2030 마음을 얻으려면...,실시간 스트리밍 시작일: 2021. 4. 8.,롤리팝,예전엔 민주당이 훨씬 더 팟캐스트 등을 이용하는 등 인터넷을 잘 활용한다고 생각했는데 지금은 국짐당에게 뺏겼다 생각됨. 이 또한 방심에서 나온 것이라 생각. 분명 국짐당은 그런 면에서 재빨리 대처했는데 민주당은 게으르게 대처했다고 봄. 지금은 전 세대가 유튜브를 보고 sns를 활용하니 그것에 대한 대처방안도 유능하게 강구하길!,2주 전,박시영TV,6.4천,83,10
#139​ 민주당 지도부가 2030 마음을 얻으려면...,실시간 스트리밍 시작일: 2021. 4. 8.,YongTaeQ Kim,LH문제를 구조적 문제의 한계였다는 말에 한숨이 나왔음. 그 구조 바꾸라고 입법 행정 권력 준거거든,2주 전(수정됨),박시영TV,6.4천,83,8
#139​ 민주당 지도부가 2030 마음을 얻으려면...,실시간 스트리밍 시작일: 2021. 4. 8.,최정상,내가 지지하는 당이지만 이번 완패는 치욕적이다. 180석으로 이룬게 없다,2주 전(수정됨),박시영TV,6.4천,83,29
#139​ 민주당 지도부가 2030 마음을 얻으려면...,실시간 스트리밍 시작일: 2021. 4. 8.,0 0,정치에 관심을  놓고싶다.,2주 전,박시영TV,6.4천,83,6
#139​ 민주당 지도부가 2030 마음을 얻으려면...,실시간 스트리밍 시작일: 2021. 4. 8.,복사골,cjd 언론 어떻게 해야하지 않을까요??,2주 전,박시영TV,6.4천,83,5
#139​ 민주당 지도부가 2030 마음을 얻으려면...,실시간 스트리밍 시작일: 2021. 4. 8.,김문주,감사합니다,2주 전,박시영TV,6.4천,83,7
#139​ 민주당 지도부가 2030 마음을 얻으려면...,실시간 스트리밍 시작일: 2021. 4. 8.,불사조,무슨일이든 내마음대로안되는줄알면 구지불만을가질필요가없다 승리하면조금아는것이고 패배하면다승리하는것이다🤴🏾🤴🏾🤴🏾이기는것만알고 지는것을모른다면 다음은없다준비된자에 기회는온다오세흠 흐이많은🐕색키다1년짜리다 분명히넉임덕이올것으로생한다 구정감사시작되면 큰치명상을입고혹독한댓가을치을것으로생각한다 🩸🩸🩸🩸🩸🩸박시영TV화이팅🙏👏👏👏👏👏👏👏👏👏🏆🏆,2주 전,박시영TV,6.4천,83,10
#139​ 민주당 지도부가 2030 마음을 얻으려면...,실시간 스트리밍 시작일: 2021. 4. 8.,ᄏᄏᄏ,"황희두위원님,이선옥자가님 얘기 민주당은 주기적으로 특강을 들어야할듯~그분들 정확한 진단들이심 !!",2주 전,박시영TV,6.4천,83,5
#139​ 민주당 지도부가 2030 마음을 얻으려면...,실시간 스트리밍 시작일: 2021. 4. 8.,together,포털도  이제부터 잘  안보려구요,2주 전,박시영TV,6.4천,83,3
#139​ 민주당 지도부가 2030 마음을 얻으려면...,실시간 스트리밍 시작일: 2021. 4. 8.,Fish & Chips,타협은 이제 그만~ 사기꾼들 상대로 무슨 대화를 한다고.. 저것들 인간되길 포기 한 것들 입니다.이래도 욕먹고 저래도 욕먹으니 쎄게 밀어붙일 수 있는 사람이 필요! 지지자들 홧병나게 생겼어요.,2주 전,박시영TV,6.4천,83,13
#139​ 민주당 지도부가 2030 마음을 얻으려면...,실시간 스트리밍 시작일: 2021. 4. 8.,김진태,민주당 중진이란 작자들은움추리는것만 배웠다열일하는 초선들에게 나대지말라 했단다와?선배들이 한게무엇이냐?당당하게 유권자들이 뽑아주었다눈치보며 국회의원한번더해보게? 아직도 정신못차렸구만,2주 전,박시영TV,6.4천,83,13
#139​ 민주당 지도부가 2030 마음을 얻으려면...,실시간 스트리밍 시작일: 2021. 4. 8.,Young Yoo Yoo,엄중협치 좋아요 부동산투기 좋아 좋아 그린벨트 36억 LCT 2채소유자가 최고영웅대접 받고 전광훈도 사랑하는 국민성 대한민국 만세 ㅠ ㅠ,2주 전,박시영TV,6.4천,83,11
#139​ 민주당 지도부가 2030 마음을 얻으려면...,실시간 스트리밍 시작일: 2021. 4. 8.,이창배,공수처 는제대로 어떻게되갑니까 궁금하네요,2주 전,박시영TV,6.4천,83,2
#139​ 민주당 지도부가 2030 마음을 얻으려면...,실시간 스트리밍 시작일: 2021. 4. 8.,Stanley Kim,아들들이 그동안 진보 성향이었는데 부동산으로 인해 국힘으로 갔습니다.,2주 전,박시영TV,6.4천,83,14
#139​ 민주당 지도부가 2030 마음을 얻으려면...,실시간 스트리밍 시작일: 2021. 4. 8.,양쓰,정신못차린거 같은데? 이러면 또져 ㅋㅋ,2주 전,박시영TV,6.4천,83,1
#139​ 민주당 지도부가 2030 마음을 얻으려면...,실시간 스트리밍 시작일: 2021. 4. 8.,ann CHO,"속상해서, 코피 터졌나봅니다~^^;저도 혈압 터지는줄 알았습니다.다시 기운 냅시다~^^",2주 전,박시영TV,6.4천,83,1
#139​ 민주당 지도부가 2030 마음을 얻으려면...,실시간 스트리밍 시작일: 2021. 4. 8.,청소대반장,윤석렬을 검찰청장으로 만든게 최악의 인사. 검찰청장 하나 어쩌지 못 하는 나라가 세상에 어딨냐? 2년 동안 윤석렬 때문에 스트레스 받아 암 걸리는 줄. 2030이 문제가 아니라 집토끼들 부터 잡아야지.,2주 전,박시영TV,6.4천,83,11
#139​ 민주당 지도부가 2030 마음을 얻으려면...,실시간 스트리밍 시작일: 2021. 4. 8.,나비,누가  말하던지협치라는건  개소리라고본다협치  협치하다오늘날  요모양 요꼴됐다,2주 전,박시영TV,6.4천,83,15
#139​ 민주당 지도부가 2030 마음을 얻으려면...,실시간 스트리밍 시작일: 2021. 4. 8.,김문순,박시영 평론가님 최고,2주 전,박시영TV,6.4천,83,25
#139​ 민주당 지도부가 2030 마음을 얻으려면...,실시간 스트리밍 시작일: 2021. 4. 8.,together,그렇다고 나두겠다는건  말이 안된다,2주 전,박시영TV,6.4천,83,0
#139​ 민주당 지도부가 2030 마음을 얻으려면...,실시간 스트리밍 시작일: 2021. 4. 8.,Nicole hwang,포털에서 뉴스 금지,2주 전,박시영TV,6.4천,83,3
#139​ 민주당 지도부가 2030 마음을 얻으려면...,실시간 스트리밍 시작일: 2021. 4. 8.,남승열,이런 분들이 안보이는게 20 30 마음을 그나마 잡는 겁니다,2주 전,박시영TV,6.4천,83,0
#139​ 민주당 지도부가 2030 마음을 얻으려면...,실시간 스트리밍 시작일: 2021. 4. 8.,거북이,응원함니다,2주 전,박시영TV,6.4천,83,0
#139​ 민주당 지도부가 2030 마음을 얻으려면...,실시간 스트리밍 시작일: 2021. 4. 8.,길은지,홍철없는홍철팀도 아니고...제발 20대 표심은 20대 불러놓고 하세요 ㅜ____________ㅜ,2주 전,박시영TV,6.4천,83,1
#139​ 민주당 지도부가 2030 마음을 얻으려면...,실시간 스트리밍 시작일: 2021. 4. 8.,Jenny Shim,장경태한테 후원금 보냈는데!!! 오늘 진짜 열받네요. 후원금 돌려받게 전화 번호 아시는분 알려주세요,2주 전,박시영TV,6.4천,83,1
#139​ 민주당 지도부가 2030 마음을 얻으려면...,실시간 스트리밍 시작일: 2021. 4. 8.,Joshua Kim,만이라도 리더가 없어서 어영부영 하면 대선 지는걵가요 요요요요요요요요ㅛ요,2주 전,박시영TV,6.4천,83,0
#139​ 민주당 지도부가 2030 마음을 얻으려면...,실시간 스트리밍 시작일: 2021. 4. 8.,최호,지금 민주 국회아해들은 도대체머하고 있는지,2주 전,박시영TV,6.4천,83,0
#139​ 민주당 지도부가 2030 마음을 얻으려면...,실시간 스트리밍 시작일: 2021. 4. 8.,다정이,선거 후 방송 중 젤 해소됨!,2주 전,박시영TV,6.4천,83,2
#139​ 민주당 지도부가 2030 마음을 얻으려면...,실시간 스트리밍 시작일: 2021. 4. 8.,Songmi Ahn,젊은 청년들이 살기힘든 시대이기는 하지만 자신뿐만 아니라 주변도 돌아보며 살 수 있는 이기적 개인주의에서 이타적인 삶을 꾸려갈 수있기를 기대합니다. 청년들의 1인 독고노인과 연결해 자원봉사할 수 있는 일들이 많습니다.,2주 전(수정됨),박시영TV,6.4천,83,2
#139​ 민주당 지도부가 2030 마음을 얻으려면...,실시간 스트리밍 시작일: 2021. 4. 8.,Momo,확실히 박시영대표님 분석력이 뛰어나다는게 느껴집니다. 저도 지금 시점에서는 황희두님이 키라고 생각해요. 매번 출연빈도가 낮아서 아쉬웠는데 이번을 계기로 자주 봤으면 하네요,1주 전,박시영TV,6.4천,83,0
#139​ 민주당 지도부가 2030 마음을 얻으려면...,실시간 스트리밍 시작일: 2021. 4. 8.,니케,소통하라고 하는데 거기 출연자 부터 소통 좀 하시지,2주 전,박시영TV,6.4천,83,0
#139​ 민주당 지도부가 2030 마음을 얻으려면...,실시간 스트리밍 시작일: 2021. 4. 8.,행복행복,청년들 미안합니다.,2주 전,박시영TV,6.4천,83,7
#139​ 민주당 지도부가 2030 마음을 얻으려면...,실시간 스트리밍 시작일: 2021. 4. 8.,설계된세상,🌈 피노키 오씨가  서울시장에 다시 자리 했다는개 정의의 실종이라고 봅니다 이 자가  무슨능력이 있나요  오로지 부동산에대한 개발 욕구밖에는 없는 종자예요,2주 전,박시영TV,6.4천,83,4
#139​ 민주당 지도부가 2030 마음을 얻으려면...,실시간 스트리밍 시작일: 2021. 4. 8.,꼬꼬쥐,오영환·이소영·장경태·장철민·전용기  이것들 키우냐고 정치 자영업자들 고생햇건만 ㅋㅋ,2주 전,박시영TV,6.4천,83,1
#139​ 민주당 지도부가 2030 마음을 얻으려면...,실시간 스트리밍 시작일: 2021. 4. 8.,장은수,박주민은 어찌되는건가요?,2주 전,박시영TV,6.4천,83,0
#139​ 민주당 지도부가 2030 마음을 얻으려면...,실시간 스트리밍 시작일: 2021. 4. 8.,a J,후보가 확실하면 진심은 통한다. 안 통하는 먹통까지 신경쓸 건 없고.,2주 전,박시영TV,6.4천,83,1
#139​ 민주당 지도부가 2030 마음을 얻으려면...,실시간 스트리밍 시작일: 2021. 4. 8.,이창배,7~80년대조선 동아일보 기자님들민주언론 외치다가 탄압받고 하루아침에 직장잃고위원장은 스트레스에 암으로목숨잃고  그내용을보고마음이찡합디다언론개혁 빨리할수록좋다,2주 전,박시영TV,6.4천,83,3
#139​ 민주당 지도부가 2030 마음을 얻으려면...,실시간 스트리밍 시작일: 2021. 4. 8.,이원자,박형준   오세훈 조사  받을꺼같아요 에제  와이티엔  뉴스타파 기자 가 박형준  비리  팩트체크,2주 전,박시영TV,6.4천,83,0
#139​ 민주당 지도부가 2030 마음을 얻으려면...,실시간 스트리밍 시작일: 2021. 4. 8.,JongWook,"인스타그램만 봐도 2030대는 우리가 국민의힘 대하듯, 민주당이라면 치를 떨고 있어요. 그동안 아주 치밀하고 오랫동안 진행되어진 일이라 앞으로도 간단하게 변하지는 않을 겁니다. 저쪽은 목숨걸고 정권탈환 노리고 있는데, 민주당이 너무 안주하고 있었던거 아닌가 싶습니다.",2주 전(수정됨),박시영TV,6.4천,83,21
#139​ 민주당 지도부가 2030 마음을 얻으려면...,실시간 스트리밍 시작일: 2021. 4. 8.,강진짜,제 아들이23세 인데성 피해을 보면 너무 여자편을 든다는겁니다남자는설 곳이 없다박원순  시장을보고.....,2주 전,박시영TV,6.4천,83,12
#139​ 민주당 지도부가 2030 마음을 얻으려면...,실시간 스트리밍 시작일: 2021. 4. 8.,반짝반짝,냉정한 분석으로 언론도 문제입니다~ 편파보도는 확실히 더욱 심하게 했다는 것!,2주 전(수정됨),박시영TV,6.4천,83,17
#139​ 민주당 지도부가 2030 마음을 얻으려면...,실시간 스트리밍 시작일: 2021. 4. 8.,뽀럽미,초선모임 기대했는데 오늘 5명이 내놓은 반성문은 지지자들 얼굴에 똥을 뿌려놨네이것들이 힘 실어줬더만 선거 패배를 누구 핑계를 대?어이가 없다,2주 전,박시영TV,6.4천,83,4
#139​ 민주당 지도부가 2030 마음을 얻으려면...,실시간 스트리밍 시작일: 2021. 4. 8.,오제니,우리  진보대학생들 화이팅해주어야합니다!!!,2주 전,박시영TV,6.4천,83,0
#139​ 민주당 지도부가 2030 마음을 얻으려면...,실시간 스트리밍 시작일: 2021. 4. 8.,존버,이 논의를 총선 때 했어야지 이제 와서 발등에 불 떨어진 것 처럼 하면 2030이 마음을 돌립니까?,2주 전,박시영TV,6.4천,83,2
#139​ 민주당 지도부가 2030 마음을 얻으려면...,실시간 스트리밍 시작일: 2021. 4. 8.,신의아들,민주가 이겼다면서요? ㅋㅋㅋㅋ,2주 전,박시영TV,6.4천,83,1
#139​ 민주당 지도부가 2030 마음을 얻으려면...,실시간 스트리밍 시작일: 2021. 4. 8.,강형원,서울시장  부산시장  고발건  없어지는건가요?,2주 전,박시영TV,6.4천,83,1
#139​ 민주당 지도부가 2030 마음을 얻으려면...,실시간 스트리밍 시작일: 2021. 4. 8.,꿈꾸는해바라기,특히 20대 남자는 페미에 치이고 기득권에 치이고  누구도 본인들의 목소리를 들으려히지 않는 분노가 있는듯 합니다 계급장 다떼고 그들과 소통하세요,2주 전,박시영TV,6.4천,83,5
#139​ 민주당 지도부가 2030 마음을 얻으려면...,실시간 스트리밍 시작일: 2021. 4. 8.,Heee God,단순합니다 일반시민들은 총선때 코로나  대처평가로 엄청난 기대를하고 긍정적으로 표를 던졌는데 진전이없으니 속았다고 생각하는겁니다,2주 전(수정됨),박시영TV,6.4천,83,6
#139​ 민주당 지도부가 2030 마음을 얻으려면...,실시간 스트리밍 시작일: 2021. 4. 8.,김형진,제발 바꿔줘요,2주 전,박시영TV,6.4천,83,0
#139​ 민주당 지도부가 2030 마음을 얻으려면...,실시간 스트리밍 시작일: 2021. 4. 8.,이원자,을지로 위원회가   뭐하는지   모르는   사람들 이태반입니다  알리는것도  중요합니다,2주 전,박시영TV,6.4천,83,0
#139​ 민주당 지도부가 2030 마음을 얻으려면...,실시간 스트리밍 시작일: 2021. 4. 8.,장은수,이해찬만한 사람 없다,2주 전,박시영TV,6.4천,83,0
#139​ 민주당 지도부가 2030 마음을 얻으려면...,실시간 스트리밍 시작일: 2021. 4. 8.,to plu,2030 남성 다 돌아선 마당에 아직도 여성 타령 하는 멍청한 권 모 씨 같은 부류들 전부 치워버리지 않으면 앞으로도 답 없다,2주 전(수정됨),박시영TV,6.4천,83,5
#139​ 민주당 지도부가 2030 마음을 얻으려면...,실시간 스트리밍 시작일: 2021. 4. 8.,Hoon Lee,트럼프와 힐러리 싸움 + 부동산 절망,2주 전,박시영TV,6.4천,83,0
#139​ 민주당 지도부가 2030 마음을 얻으려면...,실시간 스트리밍 시작일: 2021. 4. 8.,신정춘,#임대사업자 패지해야합니다 1가구 1주택,2주 전,박시영TV,6.4천,83,8
#139​ 민주당 지도부가 2030 마음을 얻으려면...,실시간 스트리밍 시작일: 2021. 4. 8.,배인재의 영어 및 주식 교육채널,유튜브에서 배인재 검색하면 재미있는 주식전망과 영어 배우기 동영상 있어요,2주 전,박시영TV,6.4천,83,1
#139​ 민주당 지도부가 2030 마음을 얻으려면...,실시간 스트리밍 시작일: 2021. 4. 8.,롤리팝,하나더 추가합니다. 민주당 의원들 유능하다는 느낌 잘 안듭니다. 그냥 국짐당의원들과 별반 다르지 않은 적폐라는 인식을 어떻게 깰것인지. 제발 국회의원소환제나 이해충돌법 등 국민들이 환영하는 법안 좀 제발 통과시키길. 세금에 관해선 돈내는 좋아하는 사람 아무도 없으니 제발 세심하게 설득하고 이해를 구하는 작업이 있으면 좋겠음,2주 전,박시영TV,6.4천,83,11
#139​ 민주당 지도부가 2030 마음을 얻으려면...,실시간 스트리밍 시작일: 2021. 4. 8.,ssanjin,180 일하라고 줬더니 이래저래 끌기나하고 이것들도 똑같은 것들이네 취급 당한것이다.반성해라,2주 전,박시영TV,6.4천,83,0
#139​ 민주당 지도부가 2030 마음을 얻으려면...,실시간 스트리밍 시작일: 2021. 4. 8.,신재현,언론이 관심을 안주는데 누가 알구 있습니까,2주 전,박시영TV,6.4천,83,0
#139​ 민주당 지도부가 2030 마음을 얻으려면...,실시간 스트리밍 시작일: 2021. 4. 8.,보실,박병석 이낙연 김태년  가장큰적패그동안  속이더졌다조국장관님 추미애장관님 고통당할때검찰 개혁언론 개혁주택하늘높은지오른가격어떤일을했는지지겹게 끌면서  국민을 지치게만들게하고ㅡ,2주 전,박시영TV,6.4천,83,18
#139​ 민주당 지도부가 2030 마음을 얻으려면...,실시간 스트리밍 시작일: 2021. 4. 8.,gusdml kim,작은집을 만들자요  제발 우리나라 땅도 좁은데 집들이 너무 커요 핵가족시대에,2주 전,박시영TV,6.4천,83,0
#139​ 민주당 지도부가 2030 마음을 얻으려면...,실시간 스트리밍 시작일: 2021. 4. 8.,jaime lannister,이번  기회에  20대중에  이준석처럼  샛별을  몇명  뽑아서  키워야  20대의  목소리를  생생하게  들을수  있다.김남국의원  30대후반인데  20대  목소리를  대변할수  없어요.,2주 전,박시영TV,6.4천,83,1
