Title,Date,ID,Comment,Comment_date,Channel,Like,Dislike,Comment_like
"#140​ 선거기간 언론행태, 정말 빡친다! 초선 2030 왜 이러나!",실시간 스트리밍 시작일: 2021. 4. 9.,유창준,"모름지기,  지도자는 백성중에 맨 위에 있는 사람이 아니고,  비, 바람 막아주는 맨 앞에 있는 사람이어야 한다고 했습니다.  나는,  이 사람이 이재명 지사 라 생각 합니다.",2주 전,박시영TV,8.2천,118,0
"#140​ 선거기간 언론행태, 정말 빡친다! 초선 2030 왜 이러나!",실시간 스트리밍 시작일: 2021. 4. 9.,TaeSik Kim,"조선희 팀장님 좋은 콘텐츠 앞으로 기대됩니다.추가로 다음 부분의 내용 조심 스럽게 참고해 주시면 좋겠습니다. 대화할때 추임이라고 해야 하나요 대화를 듣는 다는 의미로 하시는 것 같은데 계속 ""음음음,  으으음""하시는데 방송에서 듣기에 좀 거북합니다. 대화할때  네네네, 네네  등등도 그렇습니다.",2주 전(수정됨),박시영TV,8.2천,118,0
"#140​ 선거기간 언론행태, 정말 빡친다! 초선 2030 왜 이러나!",실시간 스트리밍 시작일: 2021. 4. 9.,Jason S.,"공천할 때 셀럽이나 성공한 젊은이 찾지 말고, 삶의 괘적이 올바르고 민주시민으로서의 사상이 온전하게 형성되어 있는지 체크해라. 민주당 의원이라는 자들이 조중동이 후렴처럼 읊어대는 뜬금없는 얘기나 하고 한심해서 말이 안나온다...",1주 전(수정됨),박시영TV,8.2천,118,0
"#140​ 선거기간 언론행태, 정말 빡친다! 초선 2030 왜 이러나!",실시간 스트리밍 시작일: 2021. 4. 9.,오렌지라임,정체성도 핵심도 모르는 초선들 때문에 열불니는데 더 열불납니다. 속터져 미치겟음. 개혁하라고 밀어줬는데 흐지부지하고 헐렁하니 민심이 돌아서는겁니다. 뭘 제대로 알아야지 ㅠㅠㅠ 이러다 정말 정권 빼앗깁니다. 정신좀 차려라. 초선들아. 민주 지지자들은 지금 강력한 개혁을 원하는거다. 이낙연처럼 중탕 타협이 아니라. 힘빠져 진짜 ...,2주 전,박시영TV,8.2천,118,2
"#140​ 선거기간 언론행태, 정말 빡친다! 초선 2030 왜 이러나!",실시간 스트리밍 시작일: 2021. 4. 9.,천태랑,대한민국에 선거에 큰 개념은  정권심판.  180석을 주었으매도  개혁적인 모습이 보이지 않은 실망감. 에이 국짐이나 찍자,2주 전,박시영TV,8.2천,118,0
"#140​ 선거기간 언론행태, 정말 빡친다! 초선 2030 왜 이러나!",실시간 스트리밍 시작일: 2021. 4. 9.,ᄂᄂ,금태섭 조응천 박용진 김해영 히는말에 전적으로 반대하고 동의 안합니다 금태섭은 대표적 내로남불 철새 정치인이라고 생각합니다 그런데 선거 결과가 이렇게 나오면 대다수 사람들이 그렇게 인식하고 있다는겁니다 그럼 총선때는 왜 결과가 달랐느냐? 코로나 사태로 모든 이슈를 덮어버린 선거라는걸 선거전문가인 박대표님이 잘 알지 않습니까? 여기서 조국사태 를 계속 반박해봤자 프레임만 더 강화되고 이게 대선까지 잠재되었다가 터지면 또 속수무책으로 당하는겁니다 불리한 프레임을 깰려면 인정하고 넘어가면 됩니다 어차피 억울하다고 지금 반박해봤자 아무도 안들어줍니다 아직도 정신 못 차렸다는둥 태도 가지고 또 시비를 걸테고 수렁으로 들어가는겁니다  일단 접은때는 과감하게 접고 우리우 발언권이 커지면 사실은 말이야 그때 이랬고 저랬고 하나 하나 반박하면 됩니다 집권을 못하면 조국도 잃고 문통도 불행해지고 우리는 또 저런 자들에게 통치를 받는 암울한 상황이 오지 않겠습니까? 집권이 오로지 목표입니다 잊지 말아요,2주 전,박시영TV,8.2천,118,1
"#140​ 선거기간 언론행태, 정말 빡친다! 초선 2030 왜 이러나!",실시간 스트리밍 시작일: 2021. 4. 9.,always TOP,동내방내 나경원 외치고 다니니 나경원이 못올라 왔지 댁이 무슨 전략가야,2주 전,박시영TV,8.2천,118,0
"#140​ 선거기간 언론행태, 정말 빡친다! 초선 2030 왜 이러나!",실시간 스트리밍 시작일: 2021. 4. 9.,K L,초선족 앞으로 절대 부르지 말아주세요!!!! 배은망덕한 인간들,2주 전,박시영TV,8.2천,118,0
"#140​ 선거기간 언론행태, 정말 빡친다! 초선 2030 왜 이러나!",실시간 스트리밍 시작일: 2021. 4. 9.,광안대교,김해영을 비롯한 민주당 내 수박들을 내 보내라,2주 전,박시영TV,8.2천,118,9
"#140​ 선거기간 언론행태, 정말 빡친다! 초선 2030 왜 이러나!",실시간 스트리밍 시작일: 2021. 4. 9.,리얼유토피아,문제는 안진걸 선생님만 권토중래지 정작 민주당 의원들은 뺏찌 달고 입만 나불 ㅡㅡ 움직여라 의원들아,2주 전,박시영TV,8.2천,118,2
"#140​ 선거기간 언론행태, 정말 빡친다! 초선 2030 왜 이러나!",실시간 스트리밍 시작일: 2021. 4. 9.,Lighthawk,검찰과 사법부가 국짐당편인데 오세훈 유죄 나올까요? 민주당이 사법농단 판사들 탄핵도 안 해서 이상한 판결 얼마나 많이 나왔습니까? 민주당은 지들이 일을 못해놓고 어디다 뒤집어 씌우냐고요? 조국 전 장관님 일은 2019년이었는데 2020년 총선 승리 어떻게 했습니까? 정말 어이가 없습니다.,2주 전(수정됨),박시영TV,8.2천,118,0
"#140​ 선거기간 언론행태, 정말 빡친다! 초선 2030 왜 이러나!",실시간 스트리밍 시작일: 2021. 4. 9.,니나,전 민주당 초선의원들이 잘했다고 생각합니다. 그동안 민주당과 문재인 정부가 잘못했던거 잘 집어줬다고 생각해요. 실제로 맘 떠난 분들도 초선의원 말 듣고 잘했다 민주당 정신차리면 다시 뽑을 거다 이렇게 말하는 분들 많던데... 강성 지지자분들은 대통령 공격한다고 생각해서 그러시는 건가요? 민주당 힘들겠다 집토끼랑 중도층 다 잡으려면....저 말 민주당 지도부가 했어야지하고 생각했는데🙄,2주 전,박시영TV,8.2천,118,0
"#140​ 선거기간 언론행태, 정말 빡친다! 초선 2030 왜 이러나!",실시간 스트리밍 시작일: 2021. 4. 9.,스윙,민주당 초선들 정신차려라 ~~ 달린 입이라고 함부로 찌꺼리지마라~~,2주 전,박시영TV,8.2천,118,3
"#140​ 선거기간 언론행태, 정말 빡친다! 초선 2030 왜 이러나!",실시간 스트리밍 시작일: 2021. 4. 9.,여행자,5명의초선의원들 성명을보면서 잘못된거반성하는것에대해서는  이해했지만  조국전장관님 거론한것에대해서는 화가났다.  검찰에의해 엄청난피해를 입고 계신분이고  그분으로인해 검찰개혁이 국민의공감을받은것은 맞는데 이제와서  그분으로인해 피해를본듯 말하는건 어이가없었다.   분명 그분의 희생으로 이득봐놓고  말이다. 사과하기바란다.,2주 전,박시영TV,8.2천,118,0
"#140​ 선거기간 언론행태, 정말 빡친다! 초선 2030 왜 이러나!",실시간 스트리밍 시작일: 2021. 4. 9.,Code_Zero,민주당 쫌 잘해라.. 에휴... 이건 국힘당때문에 표를 안줄수도 없고... 민주당 하는짓보면 돌아버리겠다...,2주 전,박시영TV,8.2천,118,0
"#140​ 선거기간 언론행태, 정말 빡친다! 초선 2030 왜 이러나!",실시간 스트리밍 시작일: 2021. 4. 9.,박진숙,환경운동한다고하는 이소영의원 아이들에게좋은환경 주기위해 환경운동한다고 했지만 부끄러운엄마가 무슨~ 부모를  부인하는자식이  된다는것,2주 전,박시영TV,8.2천,118,0
"#140​ 선거기간 언론행태, 정말 빡친다! 초선 2030 왜 이러나!",실시간 스트리밍 시작일: 2021. 4. 9.,박windy,민주당은 오히려  오만하지  못해서 졌다. 남은 시간은  오만하게  적폐청산해라,2주 전(수정됨),박시영TV,8.2천,118,1
"#140​ 선거기간 언론행태, 정말 빡친다! 초선 2030 왜 이러나!",실시간 스트리밍 시작일: 2021. 4. 9.,kss blue,선거내내 사과만하는 민주당수박 지도부들... 선거지니까 후보내지 말았어야 한다는 황당한  민주당 수박의원들  기레기언론의 무조건적으로 박원순 비난할때검찰개혁전쟁기간에는 침묵하던 인간들이 선거 책임을 박원순 조국 추미애에게 전가하는 민주당 초선 수박의원들선거패배의 원인조차 잘못 찾고 있다니.....,2주 전(수정됨),박시영TV,8.2천,118,1
"#140​ 선거기간 언론행태, 정말 빡친다! 초선 2030 왜 이러나!",실시간 스트리밍 시작일: 2021. 4. 9.,JH Lee,코로나 시국에 국짐의 이준석과 술처먹다가 걸린 장경태가 민주당 초선2030 이지? 방송에서 상대패널이라고 같이 술처먹고 하나보지? 낮에는 국민 앞에서 싸우는 척하고 밤에는 같이 어깨동무 술처묵하고.. 도끼자루 썪는 줄이나 아는가??,2주 전,박시영TV,8.2천,118,0
"#140​ 선거기간 언론행태, 정말 빡친다! 초선 2030 왜 이러나!",실시간 스트리밍 시작일: 2021. 4. 9.,꼭두새벽,"초선의원들은 니들판단에 국민을 생각한다고 하지만....그런 고귀한 생각말고.....한놈만 죽으라고 물어뜯어라....그러면 큰인물 된다.....저쪽의 대권후보급의 잘못을 물어뜯어라....집요하게....패스트트랙 같은거 와이리 진행이 더디냐고....검찰을 집요하게 뜯던가......그런 용기도 없으면 그만둬라...생각도 없고, 용기도 없고, 집요함도 없고.....ㅉㅉㅉㅉㅉㅉ",2주 전,박시영TV,8.2천,118,0
"#140​ 선거기간 언론행태, 정말 빡친다! 초선 2030 왜 이러나!",실시간 스트리밍 시작일: 2021. 4. 9.,김나희,우리는 조국 추미애 전 장관에게 진 빚을 잊으면 안됩니다,2주 전,박시영TV,8.2천,118,0
"#140​ 선거기간 언론행태, 정말 빡친다! 초선 2030 왜 이러나!",실시간 스트리밍 시작일: 2021. 4. 9.,김영수,초선의원 대단히 실망입니다. 더 고민해보십시요.,2주 전,박시영TV,8.2천,118,1
"#140​ 선거기간 언론행태, 정말 빡친다! 초선 2030 왜 이러나!",실시간 스트리밍 시작일: 2021. 4. 9.,Seol hur,걱정할거 없슴메  민주당은  이번 보궐선거로  더 쇄신하고  야당 꼴똥들은 개박살 날거니까 너무 걱정 마시길,2주 전,박시영TV,8.2천,118,2
"#140​ 선거기간 언론행태, 정말 빡친다! 초선 2030 왜 이러나!",실시간 스트리밍 시작일: 2021. 4. 9.,Jae Yun,"2030이 아니라 현실인식이 잘못된 강경파, 어준이가 문제다~~",2주 전,박시영TV,8.2천,118,0
"#140​ 선거기간 언론행태, 정말 빡친다! 초선 2030 왜 이러나!",실시간 스트리밍 시작일: 2021. 4. 9.,릴리,국회의원이나 하겠다고 나선 사람들이 이 정도로 정무적 판단을 하지 못하고 민주당 지지자들의 반발을 불러일으키고 물의를 일으켰다면 그만하시는게 맞다고 봅니다.  초선이라 그럴 수 있다구요? 아니요. 당신들은 10대가 아니고 앞뒤 판단할 수 있는 성인들이잖아요. 민심을 읽지 못하는 의원들은 필요 없습니다. 조국 장관을 언급한 순간 그대들은 영원한 아웃이 되었음을 알아 두시기 바랍니다.,2주 전,박시영TV,8.2천,118,1
"#140​ 선거기간 언론행태, 정말 빡친다! 초선 2030 왜 이러나!",실시간 스트리밍 시작일: 2021. 4. 9.,Shinhee Park,"초선의원 5인에 대한 박시영 대표님 발언,좋은게 좋은거다.비판은 나중에 좀 더  보고 나서 하고한번 더 믿어보자.자꾸만 희망회로 돌리며민주당 믿어보자 믿어보자그러다 이런 결과가 욌다.",2주 전,박시영TV,8.2천,118,7
"#140​ 선거기간 언론행태, 정말 빡친다! 초선 2030 왜 이러나!",실시간 스트리밍 시작일: 2021. 4. 9.,김명희,초선 5명  이소영.장경태.장철민.오영환.전용기......당신들은 민주당의원 자격없다.국민들이 조국수호.검찰개혁외칠때 당신들은 어디에 있었나?조국수호 외친의미가 단지 조국지키겠다는걸로만 보였다면큰 착각이다.검찰개혁은 국민의염원이자  민주주의를 향한 국민의간절한소망이였다.조국은 검찰개혁을 위해 국민을 대신해  홀로 싸워주신분인데  이런분을 폄하하다니 결코 용서하지않을것이다.당신들도...조국 만큼만  정직하고 공정하게 살아라.제발.,2주 전(수정됨),박시영TV,8.2천,118,2
"#140​ 선거기간 언론행태, 정말 빡친다! 초선 2030 왜 이러나!",실시간 스트리밍 시작일: 2021. 4. 9.,조용갑,"최배근교수님의 의견을 민주당과 청와대가 좀 들었어야 되는데, 관료들에게 질질 끌려 다니니 그러려면 왜 민주당이 집권했습니까?문대통령 정신차려야 합니다. 최배근교수가 현정부 부동산정책을 두더지잡기 게임하듯이 한다고 전부터 지적해왔고 보편적 재난지원금 결과를 통계적으로 그렇게 설명하고 주장해왔는데 결과는?",2주 전,박시영TV,8.2천,118,0
"#140​ 선거기간 언론행태, 정말 빡친다! 초선 2030 왜 이러나!",실시간 스트리밍 시작일: 2021. 4. 9.,김인석,"문재인 대통령께 제 글 전달요망.대통령님께서 촛불시민과 약속한 적폐청산 이루어졌나요?그 적폐중 이명박근혜와 최순실만 감옥에 있을뿐, 죄에 대한 형량이나 범죄로 형성된 재산, 그리고 범죄에 가담한 측근들, 사회비리 덩어리들어느 하나 정리된 것 없습니다.이젠 결단 하십시요. 덕장으로 남으셔서 민주주의를 외치던 국민이 죽게 만드실 것인지,용장으로 남아서 국민과 함께 민주주의 살릴것인지를...그 과정에서 독단은 필요하단 것과 비리덩어리들 제거 위해선 총/칼이 필요하단것을...깡패와 범죄자를 하지마라 백번 떠들어도 바뀌지 않고,대통령이 선하니 그들은 범죄와 쌍욕으로 응대중...먼저, 대통령 측근중 검사출신과 말 않듣던 놈부터 치우고,국가합동수사본부(경찰,사이버수사대,국정원,국세청,깨어있는 검사 약간-기소 위해)를 내세워...모든 비리 공직자와 선출직 비리자 TV로 즉결공개심판(군 검사/판사가)친일파 자녀들 공무원 및 선출직 진출 금지조항 법제화.모든 언론과 포털 국유화후 구긴주주화재벌 언론 소유 금지법안 법제화.쓰레기 기자들 국민 100명으로 구성된 재평가 통해 재입사 및 퇴사처리.공수처법 개정: 검사출신 배제, 야당 비토권 제거, 다수결 원칙 공수처장 및 차장 민변 출신 명문화.재벌 문어발식 운영 제한.(강점 개별 3~4개로 통폐합)중소기업 담합제도 합법화.중소기업 기술탈취시 대기업 폐업처리 명문화.대기업의 중소기업 이익 갈취시징벌적 10배 배상 및 거래 20년 유지 법제화국민연금 활용해 금융 취약자 해소,국민연금 주식투자 금지 및국민임대주택 2% 수익투자 전환,국민연금  연금지급방식을 노인케어 방식으로 변경.건강보험 개선(악의적 의료비 청구 병/의원 폐업, 중복 진료비 청구 제거, CT/MRI DB화 및 활용(타병원 활용 불가시 환불제),의보 미적용 진료항목 사전 심사제 도입 등등",2주 전,박시영TV,8.2천,118,0
"#140​ 선거기간 언론행태, 정말 빡친다! 초선 2030 왜 이러나!",실시간 스트리밍 시작일: 2021. 4. 9.,away go,아직도 정신 못차렸구나. 얼마나 더 언론이 민주당에게 우호적이여야하나!초선과 2030이 옳다.,1주 전,박시영TV,8.2천,118,0
"#140​ 선거기간 언론행태, 정말 빡친다! 초선 2030 왜 이러나!",실시간 스트리밍 시작일: 2021. 4. 9.,동글이tv,조국장관님 건강하세요,2주 전,박시영TV,8.2천,118,0
"#140​ 선거기간 언론행태, 정말 빡친다! 초선 2030 왜 이러나!",실시간 스트리밍 시작일: 2021. 4. 9.,키보드전사,"박시영님, 여론조사만 하십시요..정치평론하지마시고..",2주 전,박시영TV,8.2천,118,0
"#140​ 선거기간 언론행태, 정말 빡친다! 초선 2030 왜 이러나!",실시간 스트리밍 시작일: 2021. 4. 9.,EM Choi,조국 장관님이 뭘 잘못했는지 오영환 말해봐라. 기회주의자여,2주 전,박시영TV,8.2천,118,2
"#140​ 선거기간 언론행태, 정말 빡친다! 초선 2030 왜 이러나!",실시간 스트리밍 시작일: 2021. 4. 9.,푸우리는,다시는  초선5인인지 뭔지 그딴것들 페널로 불러들이지 마시오  기사읽고 손이벌벌떨리고어디 지따위들이  조국장관님에 대해 그따위로  .절대로 기억하겠습니다  니들 절대로 잊지않겠다  니따위들이조국장관님을 욕보여?검찰개혁선봉에서  그가족은 온몸에 피를 철철흘리고 계시다  니따위들이 이자리에  있게 해준 조국장관님 가족이다,2주 전,박시영TV,8.2천,118,0
"#140​ 선거기간 언론행태, 정말 빡친다! 초선 2030 왜 이러나!",실시간 스트리밍 시작일: 2021. 4. 9.,blue ocean,민주당 초선이라는것들이 저모양이니 민주당 미래가 암울하다 능력없는 기회주의자들,2주 전,박시영TV,8.2천,118,0
"#140​ 선거기간 언론행태, 정말 빡친다! 초선 2030 왜 이러나!",실시간 스트리밍 시작일: 2021. 4. 9.,기레기아웃,민주당 인사들은 소위 진보언론이라는 한겨레와 경향에 대한 환상을 버리세요.,2주 전,박시영TV,8.2천,118,0
"#140​ 선거기간 언론행태, 정말 빡친다! 초선 2030 왜 이러나!",실시간 스트리밍 시작일: 2021. 4. 9.,C눈먼_아줌마,박시영 요즘 왜이리 나이브하냐? 구독취소하고 갑니다.,2주 전,박시영TV,8.2천,118,1
"#140​ 선거기간 언론행태, 정말 빡친다! 초선 2030 왜 이러나!",실시간 스트리밍 시작일: 2021. 4. 9.,Hyun Mi Ko,참 귀엽기도 하겟다 민주진영과 집단지성을 우롱하지 마시고 대한민국을 사랑한다면 박시영은 이제 여론조사 전문가로 돌아가 주세요,2주 전,박시영TV,8.2천,118,1
"#140​ 선거기간 언론행태, 정말 빡친다! 초선 2030 왜 이러나!",실시간 스트리밍 시작일: 2021. 4. 9.,이충,"초선5인이여! 국민들양당후보당연하고 각당의 당헌당규등은1도관심없음. 조국개인을 위함아닌, 한가족을 몰살하는국가폭력알고보니검찰폭력, 그래서정권심판아닌검찰개혁, 문재인신뢰와조국가족의희생을양축으로기초의회장악,국회의원180석권력준겁니다. 문재인조국보유당임에도선거폭망은 당신들과수박,귀족허상의원들때문입니다. 당환골탈퇴의원10여명제명, 후,뭉친다면, 대선승리는110%확실합니다. 최우선, 대국민선전포고를 거두고, 무조건국민께아양떨며편에서 어떻게든나쁜놈들만때려잡는다를 명심또명심합시다. 판검사언론, 또아리튼적폐들, 많으면곤란하고각10명씩만때려잡으라고 권력줬더니, 세금,대출,재산등록1도신경않쓰는진짜적폐투기꾼은못잡고, 그저만만한대국민선전포고만 남발, 대통령이검찰청장에휘둘리고, 법무장관부인이판사1명에게4년법정구속 것도,어디지방대학?고딩표창장으로, 판사1명탄핵에쌩난리 것도,벌써관심밖 과거지사에, 수천수백수십억해먹는 부동산뚜기꾼들10명만때려잡으랬더니, 4천만원짜리연립주택, 월세보증금5천만원에휘둘리더니, : 만만한국민들향해 : 전공무원재산신고? 1%라며각종부동산세금법석, 99%가손실로열받은주식 이중과세? 돈있고없고손해보고안보고국민편가르기코로나지원금난리 , 기초수급노인연금줬다뺏는공약조차 빈민편도아니고, 도둑놈들과 심심하면협치운운하니, 국민편가르지말고, 고무신한짝씩이래도주고,나쁜놈들 각각10명씩만 때려잡으면간단한데, 무능력인가보다라고 평생처음권리당원 힘실어준1명의생각. 쓰지도쓸줄도모르는권력 보스기질있다는양아치윤짜장에 이양? 건또,민주주의라? 사실,더불어민주당이 귀족적폐기득권? 치열,생존본능으로살아있는국민의영역은아닌가? 살아보니 별건아닌데-----",2주 전,박시영TV,8.2천,118,0
"#140​ 선거기간 언론행태, 정말 빡친다! 초선 2030 왜 이러나!",실시간 스트리밍 시작일: 2021. 4. 9.,JH N,"저는 호남 60대 주부이고 민주당원입니다. 김구,김대중,노무현,문재인을 존경하고 평생 민주당만 찍었습니다. 그러나 만약 이낙연이 대선후보로 나온다면 절대 찍지 않겠습니다^^",1주 전,박시영TV,8.2천,118,1
"#140​ 선거기간 언론행태, 정말 빡친다! 초선 2030 왜 이러나!",실시간 스트리밍 시작일: 2021. 4. 9.,Geonho Song,뉴육타임즈도 조국이 영향을 크게 줬고 20대인 나에게도 그런데 ㅋㅋㅋ 와 진짜 자기들 보고싶은것만 보는구나. 니들이 조국을 안고가면 중도는 앞으로 없을거야.,2주 전,박시영TV,8.2천,118,1
"#140​ 선거기간 언론행태, 정말 빡친다! 초선 2030 왜 이러나!",실시간 스트리밍 시작일: 2021. 4. 9.,김영남,초선아!짐싸서고치당으로가거라!,2주 전,박시영TV,8.2천,118,0
"#140​ 선거기간 언론행태, 정말 빡친다! 초선 2030 왜 이러나!",실시간 스트리밍 시작일: 2021. 4. 9.,네버다이,조국도 정봉주  꼴  나네민주당  쓰고 버리는  전문당의리는 1도 없는당뚜껑 연린민주당  간다,2주 전,박시영TV,8.2천,118,0
"#140​ 선거기간 언론행태, 정말 빡친다! 초선 2030 왜 이러나!",실시간 스트리밍 시작일: 2021. 4. 9.,john lee,정말걱정된다일부 초선들의 이런 단견이..조국에 대한 무리한 기소와 조사로 끓어오른 민심과 촛불로 180석이 된거 아니었나벌써 알츠에 걸린 건희?참나 말이 안나오네니들은 그때 태극기쪽 서초동이었어?그런 건희?,2주 전,박시영TV,8.2천,118,15
"#140​ 선거기간 언론행태, 정말 빡친다! 초선 2030 왜 이러나!",실시간 스트리밍 시작일: 2021. 4. 9.,ajaja aja,민주당 초선들..수박들 너희들 하는 짓이..유신민을 보내고. 조국을 보내고. 박원순을 보내고...노무현대통령님을 보냈다..이제는 문제인 대통령까지 보내고 추가 기자회견 할꺼니..절망적이다...그 이후에는 지방 토호 난닝구 수준으로 전락하고 해산되는 수순으로 가겠지..희망과 관심을 접는게 ..속이 편하겠다....절망적이다...,2주 전,박시영TV,8.2천,118,0
"#140​ 선거기간 언론행태, 정말 빡친다! 초선 2030 왜 이러나!",실시간 스트리밍 시작일: 2021. 4. 9.,이봉건,민주당은 미래가 없다!그냥 열린민주당 찍을련다!싹수가 노래!,2주 전,박시영TV,8.2천,118,1
"#140​ 선거기간 언론행태, 정말 빡친다! 초선 2030 왜 이러나!",실시간 스트리밍 시작일: 2021. 4. 9.,Chung-hee Kim,"전반적으로 20-30대 문제네요. 민주당 초선도 저러는데, 더이상 무슨 말이 필요한지. 기본 인성교육이 문제 인듯 싶네요.",2주 전,박시영TV,8.2천,118,1
"#140​ 선거기간 언론행태, 정말 빡친다! 초선 2030 왜 이러나!",실시간 스트리밍 시작일: 2021. 4. 9.,김호두,"우리는 조국에게 큰빚을 졌다..추미애에게도 큰빚을 졌다..그러나 초선5적,민주당에겐 빚이 없다. 잘 기억하고 언행에 조심해라.니깟것들이 뭐라고 그입에 조국을 올리나..니놈들 이뻐서 국회의원 뱃지 달아 준줄 아냐..대통령님 일하시는데 국짐당이 하도 발목 잡는 꼬라지 보기 싫어서 밀어준거다. 어제부터 오늘까지 하는 꼬라지보니 정권 넘겨줄까 겁난다.그때도 남탓해라.",2주 전,박시영TV,8.2천,118,2
"#140​ 선거기간 언론행태, 정말 빡친다! 초선 2030 왜 이러나!",실시간 스트리밍 시작일: 2021. 4. 9.,Gisun Nam,쓰레기 조중도도 못 없애면서 무슨 언론개혁. 왜 민주당은 한발씩 늦지.문재인 정부 초기: 부동산 공급늘려라 - 말 않들음180석 총선 승리후: 언론개혁 -지지 부진대가리에 똥만든 인간들아,2주 전,박시영TV,8.2천,118,0
"#140​ 선거기간 언론행태, 정말 빡친다! 초선 2030 왜 이러나!",실시간 스트리밍 시작일: 2021. 4. 9.,Chong Lee,이전라도 유투버들 왜 이낙연이에대해선 함구하고 있는지 단한마디를 안하고 민주진영 분열을 야기시키고 지게만든 일본사상을가진넘에게 말한마디를 안하는지 요,2주 전,박시영TV,8.2천,118,1
