Title,Date,ID,Comment,Comment_date,Channel,Like,Dislike,Comment_like
"#140​ 선거기간 언론행태, 정말 빡친다! 초선 2030 왜 이러나!",실시간 스트리밍 시작일: 2021. 4. 9.,Oh보스,착한 안진걸용감한 안진걸정직한 안진걸순수한 안진걸의리의 안진걸항상 응원합니다.,2주 전,박시영TV,8.2천,118,64
"#140​ 선거기간 언론행태, 정말 빡친다! 초선 2030 왜 이러나!",실시간 스트리밍 시작일: 2021. 4. 9.,장브레송,오세훈이 국무회의 참석하는 상상하면피가 거꾸로 솓음,2주 전,박시영TV,8.2천,118,16
"#140​ 선거기간 언론행태, 정말 빡친다! 초선 2030 왜 이러나!",실시간 스트리밍 시작일: 2021. 4. 9.,ᄋ힘내자,2030이  어쩌면  중도충이  제일  많은데   뉴스자체를  포털로   봅니다중도층 2030표심  잡기위해서라도   포탈  언론개혁이  제일  시급하다고  생각합니다,2주 전,박시영TV,8.2천,118,81
"#140​ 선거기간 언론행태, 정말 빡친다! 초선 2030 왜 이러나!",실시간 스트리밍 시작일: 2021. 4. 9.,야인,민생경제 안소장님 같은분들이 국회에서 일을하면 참 잘하실것 같아요 ~,2주 전,박시영TV,8.2천,118,39
"#140​ 선거기간 언론행태, 정말 빡친다! 초선 2030 왜 이러나!",실시간 스트리밍 시작일: 2021. 4. 9.,먹튀,수박오인방을  반성할때까지  진보유투버들께서는  지속적으로 거론하시기 바랍니다,2주 전,박시영TV,8.2천,118,40
"#140​ 선거기간 언론행태, 정말 빡친다! 초선 2030 왜 이러나!",실시간 스트리밍 시작일: 2021. 4. 9.,박미자,조국 전 장관의 희생으로 검찰 개혁이 이루어지고 그 분의 희생으로 총선에서 180석 얻었다는 것을 무시할  수는 없다고 생각합니다.,2주 전,박시영TV,8.2천,118,40
"#140​ 선거기간 언론행태, 정말 빡친다! 초선 2030 왜 이러나!",실시간 스트리밍 시작일: 2021. 4. 9.,Yenny S,초선이니 한번 봐주자가 통할 사안도 아니지만 이소영 의원이 ytn과 jtbc에 나가서까지 그런 인터뷰를 했다던데 후폭풍 어떡합니까???,2주 전,박시영TV,8.2천,118,24
"#140​ 선거기간 언론행태, 정말 빡친다! 초선 2030 왜 이러나!",실시간 스트리밍 시작일: 2021. 4. 9.,달달한my life,의원들 번호라도 알려주세요 승질나는데 문자라도 남길랍니다 내참 어이가 없어서,2주 전,박시영TV,8.2천,118,67
"#140​ 선거기간 언론행태, 정말 빡친다! 초선 2030 왜 이러나!",실시간 스트리밍 시작일: 2021. 4. 9.,blue,초선 2030 때문에 화가 납니다. 서초동 검찰개혁 촛불을 완전 무시하는 언사입니다. 화납니다 진짜,2주 전(수정됨),박시영TV,8.2천,118,57
"#140​ 선거기간 언론행태, 정말 빡친다! 초선 2030 왜 이러나!",실시간 스트리밍 시작일: 2021. 4. 9.,Inho Lee,이럴수록 더힘내서 싸워야  합니다 항상 이길수는 없는 겁니다  지면 다음에 이기면 됩니다,2주 전,박시영TV,8.2천,118,26
"#140​ 선거기간 언론행태, 정말 빡친다! 초선 2030 왜 이러나!",실시간 스트리밍 시작일: 2021. 4. 9.,이원자,오세훈   진짜 못된놈 입니다 서민은 사람으로  보지도 않습니다   측량도와주신분도  장모님이  어쩌고저쩌고  불쌍해서  해주었다는 것처럼  말할때  정말   오세훈은 않되겠다 생각했습니다,2주 전,박시영TV,8.2천,118,25
"#140​ 선거기간 언론행태, 정말 빡친다! 초선 2030 왜 이러나!",실시간 스트리밍 시작일: 2021. 4. 9.,박미자,오세훈은 거짓말도 천벌받을 일인데 셀프 보상은 절대로 용서하면 안됩니다.,2주 전,박시영TV,8.2천,118,77
"#140​ 선거기간 언론행태, 정말 빡친다! 초선 2030 왜 이러나!",실시간 스트리밍 시작일: 2021. 4. 9.,이원자,안진걸 소장님  고맙습니다   오세훈   박형준   수사 해야되는거  맞지요,2주 전,박시영TV,8.2천,118,31
"#140​ 선거기간 언론행태, 정말 빡친다! 초선 2030 왜 이러나!",실시간 스트리밍 시작일: 2021. 4. 9.,yongs choi,전용기가 발의한 법 봐라. 상속세를 미술품으로 내게 해주겠다잖아요. 이거 뭐지? 이런 애들이. 정말 모르고 그랬다고? 대 놓고 삼성 편 드는거 아냐,2주 전,박시영TV,8.2천,118,29
"#140​ 선거기간 언론행태, 정말 빡친다! 초선 2030 왜 이러나!",실시간 스트리밍 시작일: 2021. 4. 9.,Yenny S,최고의원 지난 번처럼 비개혁적 의원들로 채우지 않으려면 대의원이 지나치게 크게 의사 반영되는 선출방식 모두들 관심 가져야 하고 김용민 의원 주장처럼 방식을 바꿔야 한다고 봅니다.,2주 전,박시영TV,8.2천,118,62
"#140​ 선거기간 언론행태, 정말 빡친다! 초선 2030 왜 이러나!",실시간 스트리밍 시작일: 2021. 4. 9.,moonchild,초선5인 벌써 대선 줄서기 한 느낌적 느낌! 어디에 줄 서나 예의주시  하렵니다.,2주 전,박시영TV,8.2천,118,24
"#140​ 선거기간 언론행태, 정말 빡친다! 초선 2030 왜 이러나!",실시간 스트리밍 시작일: 2021. 4. 9.,숨겨진세상,초선 5인 반성문 조중동이 써준건 줄;;,2주 전,박시영TV,8.2천,118,122
"#140​ 선거기간 언론행태, 정말 빡친다! 초선 2030 왜 이러나!",실시간 스트리밍 시작일: 2021. 4. 9.,Julio CHO,안진걸 힘내세요. 건강 염려 됩니다.,2주 전,박시영TV,8.2천,118,28
"#140​ 선거기간 언론행태, 정말 빡친다! 초선 2030 왜 이러나!",실시간 스트리밍 시작일: 2021. 4. 9.,가본준식,안진걸님 최고 화이팅 👍👍👍👍👍,2주 전,박시영TV,8.2천,118,23
"#140​ 선거기간 언론행태, 정말 빡친다! 초선 2030 왜 이러나!",실시간 스트리밍 시작일: 2021. 4. 9.,냥아치,달면 삼키고 쓰면 뱉고 그런 썩어빠진 태도는 정치인만이 아니라 사회에서도 욕 먹어야해요. 뭘 봐줘요. 의원님들이 우리 국민들 생활과 국가운영를 좌지우지 하는 엄청난 자린데...어이없네,2주 전,박시영TV,8.2천,118,85
"#140​ 선거기간 언론행태, 정말 빡친다! 초선 2030 왜 이러나!",실시간 스트리밍 시작일: 2021. 4. 9.,박미자,민주당도 오세훈 고소 취하하면 절대로 안됩니다.취하하면 집토끼들 다 달아납니다.,2주 전,박시영TV,8.2천,118,22
"#140​ 선거기간 언론행태, 정말 빡친다! 초선 2030 왜 이러나!",실시간 스트리밍 시작일: 2021. 4. 9.,Anarcommunist,초선이라는 바둑돌을 둔 보선 패배의 책임자를 찾아내야 됩니다. 그 놈이 해를 손으로 가리려는 연막질을 하고 해당행위를 한 놈입니다.,2주 전,박시영TV,8.2천,118,30
"#140​ 선거기간 언론행태, 정말 빡친다! 초선 2030 왜 이러나!",실시간 스트리밍 시작일: 2021. 4. 9.,wood vivi,초선 ㅅㅂ 양쪽 진영에  불난 집 기름만 붓는 꼴,2주 전,박시영TV,8.2천,118,79
"#140​ 선거기간 언론행태, 정말 빡친다! 초선 2030 왜 이러나!",실시간 스트리밍 시작일: 2021. 4. 9.,1781 ka,그렇게 신념에 차서 성명서까지 결기있게 발표한 거면 초선 5명 박시영TV에 나오라고 하세요나와서 당원들을 설득을 시켜보든가 성명서 하나 달랑 발표하고 지금 어디에 있습니까,2주 전,박시영TV,8.2천,118,15
"#140​ 선거기간 언론행태, 정말 빡친다! 초선 2030 왜 이러나!",실시간 스트리밍 시작일: 2021. 4. 9.,박미자,안소장님 정말 아무리 참으려해도 눈물 아닌 피눈물이 납니다.,2주 전,박시영TV,8.2천,118,56
"#140​ 선거기간 언론행태, 정말 빡친다! 초선 2030 왜 이러나!",실시간 스트리밍 시작일: 2021. 4. 9.,Sue Wenk,"안진걸 소장님께 맛있는 음식도 사드리고싶고 어떻게든 힘을 실어드리고 싶습니다. 얼마나 수고하고 애쓰시는지, 목메이고 종종 갈라지는 목소리에서도 민생에 얼마나 애절하신지 느낄수 있습니다. 저 5인의 초선 의원들은 국민과의 공감이 무엇인지 그 의미도 잘 모르고 공감이 부족했다 말하는것 같습니다. 모르면 안진걸 소장님께 배우면 좋을것을...소장님, 건강 잘 챙기시고, 너무 속상해 마시고 힘 내십시오!!!",2주 전,박시영TV,8.2천,118,13
"#140​ 선거기간 언론행태, 정말 빡친다! 초선 2030 왜 이러나!",실시간 스트리밍 시작일: 2021. 4. 9.,bona thu,잘못도 없는데 사과하면 잘못이 있는 것으로 인정하는 꼴 / 초선 5인방의 돌대가리들,2주 전,박시영TV,8.2천,118,66
"#140​ 선거기간 언론행태, 정말 빡친다! 초선 2030 왜 이러나!",실시간 스트리밍 시작일: 2021. 4. 9.,임예은,아직도 정경심 교수님만 생각하면 가슴이아픈데  ᆢ미친초선들 진짜어이없다,2주 전,박시영TV,8.2천,118,87
"#140​ 선거기간 언론행태, 정말 빡친다! 초선 2030 왜 이러나!",실시간 스트리밍 시작일: 2021. 4. 9.,M M,초선5명 섭외 한 번 해주세요. 채팅창으로  아작을 내버리게.,2주 전,박시영TV,8.2천,118,84
"#140​ 선거기간 언론행태, 정말 빡친다! 초선 2030 왜 이러나!",실시간 스트리밍 시작일: 2021. 4. 9.,박미자,오세훈의 비리 숨기고 살았겠지만 하나님이 용서하지 않아 그 죄값을 크게 받을 것이다.,2주 전,박시영TV,8.2천,118,27
"#140​ 선거기간 언론행태, 정말 빡친다! 초선 2030 왜 이러나!",실시간 스트리밍 시작일: 2021. 4. 9.,boy tom,"검찰 ,언론개혁 안해서  진줄 모르고 멍청한소리 한거죠 촛불시민을  적의로돌린 초선오적",2주 전(수정됨),박시영TV,8.2천,118,19
"#140​ 선거기간 언론행태, 정말 빡친다! 초선 2030 왜 이러나!",실시간 스트리밍 시작일: 2021. 4. 9.,Jason Kim,포털 기사 제목 실명제를 실시하도록 합시다. 반드시 포털 기사 제목 앞에 언론사와 기자 실명을 표시 하도록 하여 포털 독자들이 언론사와 기자를 취사 선택할 수 있게 해야 합니다.그래서 그들이 더 이상 낚시성 기사로 클릭장사 못하게 하고 뉴스 소비자들이 가짜 뉴스 제목에 현혹되어 스트레스 받는 일이 없도록 합시다.,2주 전,박시영TV,8.2천,118,37
"#140​ 선거기간 언론행태, 정말 빡친다! 초선 2030 왜 이러나!",실시간 스트리밍 시작일: 2021. 4. 9.,이봉주,진짜  열불납니다!내나이  60  먹을때까지   민주당만 찍은사람입니다!이번처럼  어처구니없고  열불나기는  처음임!민주당  제발 사람좀  잘  씁시다!,2주 전,박시영TV,8.2천,118,74
"#140​ 선거기간 언론행태, 정말 빡친다! 초선 2030 왜 이러나!",실시간 스트리밍 시작일: 2021. 4. 9.,Fish & Chips,저것들 무릎꿇고 민주당 지지자들한테 사죄해야함!,2주 전,박시영TV,8.2천,118,11
"#140​ 선거기간 언론행태, 정말 빡친다! 초선 2030 왜 이러나!",실시간 스트리밍 시작일: 2021. 4. 9.,정범우,이소영 의원  jtbc 인터뷰  보셨나요? ㅋㅋㅋㅋ “뒷북 맞습니다”.  선거 이후  크게  웃었습니다.,2주 전,박시영TV,8.2천,118,16
"#140​ 선거기간 언론행태, 정말 빡친다! 초선 2030 왜 이러나!",실시간 스트리밍 시작일: 2021. 4. 9.,원철,안진걸 좋네   멋찌게  사네,2주 전,박시영TV,8.2천,118,26
"#140​ 선거기간 언론행태, 정말 빡친다! 초선 2030 왜 이러나!",실시간 스트리밍 시작일: 2021. 4. 9.,ᄑ버ᅩᅮ,초선의원분들한테 의견피력하려면 뭘 어떻게 해야할까요 이런반응조차 모르고 계신건 아닌지 실망 대실망입니다 ㅜ,2주 전,박시영TV,8.2천,118,23
"#140​ 선거기간 언론행태, 정말 빡친다! 초선 2030 왜 이러나!",실시간 스트리밍 시작일: 2021. 4. 9.,강동훈,저렇게 생각하는 2030들도 있지요 언론 때문에 잘 모르는게 문제지요지금 제대로 일을 안한게 핵심인데 ㅜㅜ😭,2주 전,박시영TV,8.2천,118,8
"#140​ 선거기간 언론행태, 정말 빡친다! 초선 2030 왜 이러나!",실시간 스트리밍 시작일: 2021. 4. 9.,민주주의만세,징벌적 손해 배상법도 일단 만들면 안 될까요?내이버 뉴스 금지법도요. 180석 거지고 뭐 하냐구요 ㅠㅠ,2주 전,박시영TV,8.2천,118,15
"#140​ 선거기간 언론행태, 정말 빡친다! 초선 2030 왜 이러나!",실시간 스트리밍 시작일: 2021. 4. 9.,미루,택배차량 못들어가게 막는 아파트는 아파트 입구에 그냥 두는 거지. 택배 없이 며칠이나 살 수 있냐,2주 전,박시영TV,8.2천,118,9
"#140​ 선거기간 언론행태, 정말 빡친다! 초선 2030 왜 이러나!",실시간 스트리밍 시작일: 2021. 4. 9.,Y. KIM,"초선의원 5명 섭외해 주세요 2030세대는 시장에서 다른 세대와는 완전히 다른 소비를 한다고 하더라고요, 그들의 사고방식이 어떤지 정치인들을 통해 들어보고 싶네요",2주 전,박시영TV,8.2천,118,10
"#140​ 선거기간 언론행태, 정말 빡친다! 초선 2030 왜 이러나!",실시간 스트리밍 시작일: 2021. 4. 9.,T P,초선 5인들 중2병 걸렸냐?,2주 전(수정됨),박시영TV,8.2천,118,10
"#140​ 선거기간 언론행태, 정말 빡친다! 초선 2030 왜 이러나!",실시간 스트리밍 시작일: 2021. 4. 9.,천 개의 바람,"초선 5인..너무 화가 납니다..조국 전 장관 덕분에 검찰의 민낯을 목도한 깨시민들 덕분에 기록적인 180석을 얻어놓고,이제와서 어디에 화살을 돌린답니까? 총선 이겼을땐 조국 전 장관 덕이 아닌 지들이 잘난거고, 보궐 패배는 조국 탓이라니..기가 막힙니다..",2주 전(수정됨),박시영TV,8.2천,118,40
"#140​ 선거기간 언론행태, 정말 빡친다! 초선 2030 왜 이러나!",실시간 스트리밍 시작일: 2021. 4. 9.,김지연,100%프로 언론때문이다,2주 전,박시영TV,8.2천,118,11
"#140​ 선거기간 언론행태, 정말 빡친다! 초선 2030 왜 이러나!",실시간 스트리밍 시작일: 2021. 4. 9.,박미자,민생 부동산 문제도 너무나 중요하지만 언론과 검찰 개혁은 민주당의 존립이 달린 문제니만큼 법안 통과에 매진하라.,2주 전,박시영TV,8.2천,118,29
"#140​ 선거기간 언론행태, 정말 빡친다! 초선 2030 왜 이러나!",실시간 스트리밍 시작일: 2021. 4. 9.,다니엘패트릭,시민기자들의 단편뉴스들을 취합해서 매일 정규방송 9시 뉴스처럼 편집해서 올리면 좋겠습니다ㆍ,2주 전,박시영TV,8.2천,118,53
"#140​ 선거기간 언론행태, 정말 빡친다! 초선 2030 왜 이러나!",실시간 스트리밍 시작일: 2021. 4. 9.,나의꿈,민언련역활부탁드립니다후원자입니다,2주 전,박시영TV,8.2천,118,32
"#140​ 선거기간 언론행태, 정말 빡친다! 초선 2030 왜 이러나!",실시간 스트리밍 시작일: 2021. 4. 9.,Untitled,초선족 절대 섭외하지 말아주세요방송 나오는 순간 뒷골이 땡길 것 같아요,2주 전,박시영TV,8.2천,118,37
"#140​ 선거기간 언론행태, 정말 빡친다! 초선 2030 왜 이러나!",실시간 스트리밍 시작일: 2021. 4. 9.,나는나,안진걸소장님 항상 고맙습니다💙,2주 전,박시영TV,8.2천,118,16
"#140​ 선거기간 언론행태, 정말 빡친다! 초선 2030 왜 이러나!",실시간 스트리밍 시작일: 2021. 4. 9.,은둔논객,"민주당이 의리없는 집단인건 예전부터 느끼고 있었지만, 초선들까지 저럴줄은 정말 상상도 못했다.너무 개탄스럽고 분노가 치밀어오른다..조국장관님에게 그런 모욕을 주다니.....",2주 전,박시영TV,8.2천,118,40
"#140​ 선거기간 언론행태, 정말 빡친다! 초선 2030 왜 이러나!",실시간 스트리밍 시작일: 2021. 4. 9.,박미자,오세훈이 측량 현장에 간 것을 그의 처가 알고 장인이 알고 그 처남이 알고 운전사가 알고 경작자가 알고 츸량기사가 알고 생태탕 주인과 아들이 알고,2주 전,박시영TV,8.2천,118,28
"#140​ 선거기간 언론행태, 정말 빡친다! 초선 2030 왜 이러나!",실시간 스트리밍 시작일: 2021. 4. 9.,박미자,안소장님 오세훈의 거짓말은 영원히 역사에 기록되어 그의 자손만대에 치욕을 겪게 될 것입니다.,2주 전,박시영TV,8.2천,118,32
"#140​ 선거기간 언론행태, 정말 빡친다! 초선 2030 왜 이러나!",실시간 스트리밍 시작일: 2021. 4. 9.,skid,싹수가 노란 것들은 미리미리 싹을 잘라야 됩니다.,2주 전,박시영TV,8.2천,118,30
"#140​ 선거기간 언론행태, 정말 빡친다! 초선 2030 왜 이러나!",실시간 스트리밍 시작일: 2021. 4. 9.,케이오cakeoh,초선 2030 왜 이러나 ..이렇게 제목을 달았으면 말 한마디라도 해야 될 것 아니냐,2주 전,박시영TV,8.2천,118,32
"#140​ 선거기간 언론행태, 정말 빡친다! 초선 2030 왜 이러나!",실시간 스트리밍 시작일: 2021. 4. 9.,hunger great,제가 만나본 20대 대부분은 정치에 별로 관심없습니다.대부분 포털로 소비하고 그걸 진실로 받아들이는 편입니다.20대뿐 아니라 대부분 중도층이라고 하는 사람들이 다 그렇죠이번 선거는 포털이 플레이어로 뛰어든 최초의 선거입니다.네이버뿐 아니라 다음까지 대한민국 양대 포털이 작정하고 뛰어들었습니다.물론 민주당의 작전실패도 있겠지만 기레기들이 썩은 기사 내고 포털이 그런 기사만 뽑아주는 알고리즘을 가지고 있다면민주당이 아무리 잘해도 국짐의 후보가 아무리 썩어문드러져도중도층의 표심을 얻기는 힘듭니다.언론과 포털개혁 반드시 필요합니다. 대선까지 얼마 안남았는데 민주당 제발 뻘짓하지 말고 정신차리세요!!,2주 전(수정됨),박시영TV,8.2천,118,32
"#140​ 선거기간 언론행태, 정말 빡친다! 초선 2030 왜 이러나!",실시간 스트리밍 시작일: 2021. 4. 9.,7080 Olle,시민포탈 지속가능하지 않은것 같네요,2주 전,박시영TV,8.2천,118,11
"#140​ 선거기간 언론행태, 정말 빡친다! 초선 2030 왜 이러나!",실시간 스트리밍 시작일: 2021. 4. 9.,h k,안진걸 소장님 말씀 깊이 공감합니다.,2주 전,박시영TV,8.2천,118,8
"#140​ 선거기간 언론행태, 정말 빡친다! 초선 2030 왜 이러나!",실시간 스트리밍 시작일: 2021. 4. 9.,한미완의꿈,안진걸 소장님 응원합니다,2주 전,박시영TV,8.2천,118,8
"#140​ 선거기간 언론행태, 정말 빡친다! 초선 2030 왜 이러나!",실시간 스트리밍 시작일: 2021. 4. 9.,Julie KIM,초선은 완전 또라이짓을 하고 있는데 이사람들 어떻게 해야되나요?? 뒤통수를 아주 제대로 치네.,2주 전,박시영TV,8.2천,118,17
"#140​ 선거기간 언론행태, 정말 빡친다! 초선 2030 왜 이러나!",실시간 스트리밍 시작일: 2021. 4. 9.,SooYeon Song,"서민들의 수호천사, 안진걸 소장님항상 감사히 생각하고 존경하고 응원해요~ 💜",2주 전,박시영TV,8.2천,118,5
"#140​ 선거기간 언론행태, 정말 빡친다! 초선 2030 왜 이러나!",실시간 스트리밍 시작일: 2021. 4. 9.,박찬우,언론바우처 제도... 꼭 되었으면 합니다!!!국민들에게... 언론의 기사 참여할 수 있는 공간을 주세요!!!,2주 전(수정됨),박시영TV,8.2천,118,6
"#140​ 선거기간 언론행태, 정말 빡친다! 초선 2030 왜 이러나!",실시간 스트리밍 시작일: 2021. 4. 9.,김나희,초선의윈들 과연 진짜 자기생각일까요?제발 소신껀 발언해주세요 그게 진심이라면 더이상 더불어민주당에 기대할께 없네요ㅠㅠ,2주 전,박시영TV,8.2천,118,9
"#140​ 선거기간 언론행태, 정말 빡친다! 초선 2030 왜 이러나!",실시간 스트리밍 시작일: 2021. 4. 9.,문규빈,우리나라에 안진걸 소장님이 있다는것이 정말 나라다운  나라가  될것 같아요,2주 전,박시영TV,8.2천,118,4
"#140​ 선거기간 언론행태, 정말 빡친다! 초선 2030 왜 이러나!",실시간 스트리밍 시작일: 2021. 4. 9.,송됴리,초선 5인 정말 화납니다.,2주 전,박시영TV,8.2천,118,70
"#140​ 선거기간 언론행태, 정말 빡친다! 초선 2030 왜 이러나!",실시간 스트리밍 시작일: 2021. 4. 9.,Asaris,180석 가까이 되니까 욕먹는 건 필연이니 확고하게좀 나가주세요. 미디어바우처 빠른 실현 부탁드립니다.,2주 전,박시영TV,8.2천,118,9
"#140​ 선거기간 언론행태, 정말 빡친다! 초선 2030 왜 이러나!",실시간 스트리밍 시작일: 2021. 4. 9.,문규빈,안진걸  완전 핵사이다  정말 위로가됩니다,2주 전,박시영TV,8.2천,118,8
"#140​ 선거기간 언론행태, 정말 빡친다! 초선 2030 왜 이러나!",실시간 스트리밍 시작일: 2021. 4. 9.,Jisun Lee,초선5인방 용서가 안됩니다.,2주 전,박시영TV,8.2천,118,22
"#140​ 선거기간 언론행태, 정말 빡친다! 초선 2030 왜 이러나!",실시간 스트리밍 시작일: 2021. 4. 9.,최돈국,초선이것들 미쳤어,2주 전,박시영TV,8.2천,118,14
"#140​ 선거기간 언론행태, 정말 빡친다! 초선 2030 왜 이러나!",실시간 스트리밍 시작일: 2021. 4. 9.,김택준,시민포털 합시다~~~~~!! 뭐든 해봅시다~~!! 우리가 뭉치고 홍보 하면 되쟎아요~~,2주 전,박시영TV,8.2천,118,4
"#140​ 선거기간 언론행태, 정말 빡친다! 초선 2030 왜 이러나!",실시간 스트리밍 시작일: 2021. 4. 9.,brussell639,"안소장님, 생태탕 식당 주인 모자 꼭 끝까지 도와주세요.돈 없는 사람이라고 언론과 짜고 사람을 완전 바보 거짓말장이로 만든 오세훈 절대 용서해선 안됩니다. 적극 지지!!!안진걸 소장님은 내 사진속 진짜 hero.",2주 전(수정됨),박시영TV,8.2천,118,7
"#140​ 선거기간 언론행태, 정말 빡친다! 초선 2030 왜 이러나!",실시간 스트리밍 시작일: 2021. 4. 9.,촌시골,초선5적 오데가서 욕해야되나욤?,2주 전,박시영TV,8.2천,118,9
"#140​ 선거기간 언론행태, 정말 빡친다! 초선 2030 왜 이러나!",실시간 스트리밍 시작일: 2021. 4. 9.,Helen Hisook Shin,안질껄 소장님 말씀에 위로 받습니다.. 감사합니다!  💙,2주 전,박시영TV,8.2천,118,3
"#140​ 선거기간 언론행태, 정말 빡친다! 초선 2030 왜 이러나!",실시간 스트리밍 시작일: 2021. 4. 9.,지산심해,안진걸소장이 영웅이고 어려운 서민들에게는 꼭 필요한존재입니다 힘내세요^^,2주 전,박시영TV,8.2천,118,3
"#140​ 선거기간 언론행태, 정말 빡친다! 초선 2030 왜 이러나!",실시간 스트리밍 시작일: 2021. 4. 9.,내리가즘,🍀🍀안진걸 소장의 분함과  답답한 속내. 그럼에도 열정의 솟구침에 무한한 신뢰를 함께합니다.👏👏👍,2주 전,박시영TV,8.2천,118,1
"#140​ 선거기간 언론행태, 정말 빡친다! 초선 2030 왜 이러나!",실시간 스트리밍 시작일: 2021. 4. 9.,Riell An,안진걸소장 통찰력이 대단하다... 내가 답답했던 심정을 너무 잘 표현해주셔서 감사하다....,2주 전,박시영TV,8.2천,118,2
"#140​ 선거기간 언론행태, 정말 빡친다! 초선 2030 왜 이러나!",실시간 스트리밍 시작일: 2021. 4. 9.,nuwanda kim,너희 다섯을 꼭 기억하겠다!,2주 전,박시영TV,8.2천,118,5
"#140​ 선거기간 언론행태, 정말 빡친다! 초선 2030 왜 이러나!",실시간 스트리밍 시작일: 2021. 4. 9.,박미자,2030 초선 의원들의 입장문은 자질 부족이  나타남 .,2주 전,박시영TV,8.2천,118,21
"#140​ 선거기간 언론행태, 정말 빡친다! 초선 2030 왜 이러나!",실시간 스트리밍 시작일: 2021. 4. 9.,초록비,안진걸 소장님!! 정말 감사합니다~,2주 전,박시영TV,8.2천,118,2
"#140​ 선거기간 언론행태, 정말 빡친다! 초선 2030 왜 이러나!",실시간 스트리밍 시작일: 2021. 4. 9.,Sungchul park,초선5인방 오영환 장경태 이소영 전용기 니들 딱 봐뒀어!!!,2주 전,박시영TV,8.2천,118,7
"#140​ 선거기간 언론행태, 정말 빡친다! 초선 2030 왜 이러나!",실시간 스트리밍 시작일: 2021. 4. 9.,김서희,이것들은 뭐가문제인지 나같은 50대아줌마보다몰라 참한심하다 니들이잘해서 뽑아줬다고생각하지말아라 열받아서 죽을거같은데 그입들다물어라,2주 전,박시영TV,8.2천,118,27
"#140​ 선거기간 언론행태, 정말 빡친다! 초선 2030 왜 이러나!",실시간 스트리밍 시작일: 2021. 4. 9.,이름성,이소영 장경태 여기 패널로 나왔던분들 아닌가요? 내참 어이가 없어가지고 다시 섭외 해주세요,2주 전,박시영TV,8.2천,118,2
