Title,Date,ID,Comment,Comment_date,Channel,Like,Dislike,Comment_like
2030세대의 보수화? 대한민국 보수는 다시 살아날 수 있을까?,2021. 4. 12.,일산아저씨,상식이 통하는 세상이 되었으면 좋겠습니다.,1주 전,성실한티비,17,2,4
2030세대의 보수화? 대한민국 보수는 다시 살아날 수 있을까?,2021. 4. 12.,해가,하루하루 나라 무너지는 소리에 가슴이 무너집니다.2030 젊은 세대들이 자신들이 살아갈 세상을 위해 깨어있다는 것이 위안입니다.그저 최소한 상식이 통하는 세상에서 살고 싶다는 바람을 가져봅니다.,1주 전,성실한티비,17,2,2
2030세대의 보수화? 대한민국 보수는 다시 살아날 수 있을까?,2021. 4. 12.,시그니엘롯데,공감100%,2주 전,성실한티비,17,2,5
2030세대의 보수화? 대한민국 보수는 다시 살아날 수 있을까?,2021. 4. 12.,이진우,절대공감!!,1주 전,성실한티비,17,2,3
2030세대의 보수화? 대한민국 보수는 다시 살아날 수 있을까?,2021. 4. 12.,이수,정치 이야기는 조심스럽고 서로의 지지자들을 깍아 내리기 바쁘죠.보수에서 진보로 정권이 바뀌는 과정과진보의 쇠퇴 과정이 진행 중인걸 영상으로 잘 만드셨네요!!한쪽 정당으로 과반수가 넘으면 늘 이런 불상사가 발생하죠 ㅠㅠ 정치는 관심이고 사랑입니다!!,1주 전,성실한티비,17,2,2
2030세대의 보수화? 대한민국 보수는 다시 살아날 수 있을까?,2021. 4. 12.,두리번,"보수화라기 보다는 지금 진보 쪽이 좆같아서 찍었다는게 정답일듯지금 20,30세대 중에 극단적으로 한쪽을 지지하는 애들은 사실상 없다고 보는게 나도 30초반인데 내친구들 중에 정치에 미쳐사는 애들은 몇없고 대부분은 그때그때 보고 본인에게 유리한 정당, 본인에게 이익이 되는 정당을 찍는게 현 세대나중에 또 보수가 좆같아지면 다시 반대로 진보를 찍겠지 그러니 여야가리지 말고 좌우 따지지말고 보수, 진보 편 나누지말고 잘좀해라 정치인 새끼들아",1주 전,성실한티비,17,2,4
2030세대의 보수화? 대한민국 보수는 다시 살아날 수 있을까?,2021. 4. 12.,아이돌컴퍼니,"전남에 거주하는 광주에서 학교 다니는 20대 남자입니다. 지금 호남지역 20대 남자들도 반페미 반민주당 정서가 퍼저셔 이미 남자들은 보수화 되었고 페미니즘 때문에 남성차별한다는 인식이 심하게 박혀있어요...학교가서 알바가서 또래 20대 남자들 지금 문재인, 민주당 욕하는게 일상일 정도로 심각합니다. 참고로 페미니즘 여성우대 남성하대 이건 지역민심을 초월해서 한국남자들 모두가 박탈감을 느끼는 동시에 분노하게 되는 원인입니다.",1주 전(수정됨),성실한티비,17,2,5
