Title,Date,ID,Comment,Comment_date,Channel,Like,Dislike,Comment_like
[2030 시민참여유세#6] 청년의 꿈과 희망을 짓밟은 정부·여당! 용서하지 않겠습니다!,2021. 4. 4.,David Koo,"안녕하세요영상에 나온 시민참여 유세자 입니다.많은 인파에 많이 더듬기도 했고 시험 준비 등 연설 준비에 미흡했습니다. 이점 죄송하게 생각됩니다.저는 2019년도 일본 워킹홀리데이 중 이였으며  XX여행사 소속의 면세점에 근무하면서 일본 취업 준비를 하고 있었습니다.해당 발생된 사건은 2019년 7월 1일 일본의 불화수소 화이트리스트 제외로 한국에서는 노재팬(반일운동)이 발생하였습니다.이후 단체 관광여행 패키지 및 공무연 연수 등 취소되는 사태가 발생하였고 면세점과 한인간 사업은 큰 타격을 입게 되었습니다.그로인해 8월부터 급격하게 일이 줄어들었고 저는 어떻게든 버텨볼려고 야간에는 식당에서 일을하며 버텼습니다.그러나 결국에는 9월을 기점으로 권고사직을 받았습니다. 이후 10월부터 Applied 주식회사라는 컴퓨터 조립 공장에서 아침에 출근해서 저녁 6시까지 일을 하였고7시에 식당에 출근해서 밤 11시까지 일을 하고 집에 돌아와 일본어 공부와 전공 공부를 하면서 생활하였습니다. 10월 중순 자고 일어났더니 양족 두 눈이 충열되면서 앞이 보이지 않았습니다. 그래서 일본에서 사귄 친한 형을 대리고 병원에 갔더니 각막상피미란이라는 병명을 듣게 되었습니다.각막이 손상되어 각막이 낫지 않고 계속 벗겨지는 증상이며 회복해도 재발성이 높은 병입니다.지금은 많이 회복되었지만 안구건조증과 재발할 수가 있어서 인공눈물을 달고 삽니다. 눈이 회복할때 까지 많은 시간이 걸리고 직장에 나가서 일을 하려고 해도 보이지 않고 집에서 쉰다고 해도 저를 돌봐줄 사람도 없고 자금은 계속해서 빠져나갔기에 결국 일본 취업을 포기하고 귀국하게 되었습니다. 이후 국내에 와서 노재팬 운동을 기획하고 실행 했던 집권여당과 집권여당을 따르는 수많은 단체를 보고 분노할 수 밖에 없었습니다. 어떻게든 취업을 하기위해 발버둥을 쳐보려는 20대의 꿈을 이렇게 짓밟을 수 있습니까?  그리고 일본에서 정착하고 한일간 관련된 일을 하는 수 많은 재외국민은 국민이 아니라서 보호해줄 가치가 없는겁니까? 더불어 한국에서 일본과 관련된 일을 하는 수 많은 근로자들은 무슨 죄를 지었습니까? 여러분 집권여당과 정부는 일자리 창출 했다고 말합니다. 그러나 그건 노인일자리 및 공공일자리이며 심지어 중소 중견 기업체에 지원받는 국가 지원금으로 뽑는 것은 대부분 체험형 인턴이며, 4대보험 납부만 하고 허위로 신고하여 지원금 횡령하는 곳이 대부분입니다.본문이 너무 길었습니다. 이번 서울시장, 부산시장 선거는 20, 30대에게 매우 중요한 선거입니다. 저는 경기도민이라서 아쉽지만 투표권이 없습니다.서울에 거주하시는 20대 30대 여러분 또 5년동안 더 겪어보실 겁니까?그리고 서울에 벼농사 짓고 양봉하고 수직정원 세워서 퇴보되는 서울을 지켜보실겁니까?4월 7일 소중한 한 표 꼭 부탁드리겠습니다. ps. 본문에서 서술한 내용은 일본에서 있었던 일이며 증언자 및 증거 제출 가능합니다.",2주 전(수정됨),오세훈TV,2.3천,56,149
[2030 시민참여유세#6] 청년의 꿈과 희망을 짓밟은 정부·여당! 용서하지 않겠습니다!,2021. 4. 4.,오늘도happy,"일본에 아파트 있으면 서울시장 나오면 안 되냐는 얘기 누가 하길래 울컥 하더라구요. 저 청년 뿐 아닙니다. 아사* 맥주 다니던 분들, 유니*로 다니던 한국인 근로자는 한국사람 아닙니까?반일 선동 때문에 실직자 만들어놓고, 죽창 들라던 시기에 일본 주식 사던 사람이 서울시장 후보랍니다. 정말 양심은 어디 있나요? 표 팔이를 위해서는 무슨 짓이라도 해도 되나 싶습니다.수요일에 다들 꼭 투표하러 나와주셔요.",3주 전,오세훈TV,2.3천,56,199
[2030 시민참여유세#6] 청년의 꿈과 희망을 짓밟은 정부·여당! 용서하지 않겠습니다!,2021. 4. 4.,김미영,이제 국민모두 깨달으셔야 합니다적화통일이꿈인  북한처럼반미 반일 감정부추기고노동자 서민을 외치며기업들 힘들게 하고경제망치는 정책을 펼치는게민주당입니다연설하는 청년을보니 너무마음이 아픕니다  나라가 이게 뭡니까,3주 전,오세훈TV,2.3천,56,124
[2030 시민참여유세#6] 청년의 꿈과 희망을 짓밟은 정부·여당! 용서하지 않겠습니다!,2021. 4. 4.,피자치즈,정말 가슴이 아픕니다 이번 선거 꼭이겨서 이 학생의 한이 조금이라도 풀어주셨으면 합니다,3주 전,오세훈TV,2.3천,56,126
[2030 시민참여유세#6] 청년의 꿈과 희망을 짓밟은 정부·여당! 용서하지 않겠습니다!,2021. 4. 4.,정의,가슴이 아프네요 20대의  아들을둔 엄마로써 그저 미안한마음뿐입니다힘내세요  우리의 아들 과  딸들아~~~,3주 전(수정됨),오세훈TV,2.3천,56,114
[2030 시민참여유세#6] 청년의 꿈과 희망을 짓밟은 정부·여당! 용서하지 않겠습니다!,2021. 4. 4.,임소옥,힘네요정권이바꾸면세상이바로설거예요정권교체가답입니다여러분이미래예요,3주 전,오세훈TV,2.3천,56,94
[2030 시민참여유세#6] 청년의 꿈과 희망을 짓밟은 정부·여당! 용서하지 않겠습니다!,2021. 4. 4.,이희망,이번 기회로 이훌륭한 젊은이들 오후보님께서 품으시길 부탁드립니다  멋지고 훌륭한 인재가 될거라믿습니다,3주 전,오세훈TV,2.3천,56,59
[2030 시민참여유세#6] 청년의 꿈과 희망을 짓밟은 정부·여당! 용서하지 않겠습니다!,2021. 4. 4.,join so,"오후보님...비단 이번 선거가 끝이 아닙니다...현재 대한민국은 9회말 2아웃 입니다..기적같이.. 상대 선수들의 실책으로주자는 만루!! 4번타자 ""오세훈""의 강력한 만루홈런으로 대한민국을 재건합시다!!!",3주 전(수정됨),오세훈TV,2.3천,56,67
[2030 시민참여유세#6] 청년의 꿈과 희망을 짓밟은 정부·여당! 용서하지 않겠습니다!,2021. 4. 4.,daebak77,근모 청년 넘 눈물난다. ㅅㅂ미친 공산당 땜에  ...,2주 전,오세훈TV,2.3천,56,18
[2030 시민참여유세#6] 청년의 꿈과 희망을 짓밟은 정부·여당! 용서하지 않겠습니다!,2021. 4. 4.,쁘라나,그렇게 열심히 일하다건강까지 잃었다니ᆢ우는 모습에. 제맘이 무너집니다토닥이시는 오후보님의 손길에제 손길을 얹습니다어쩔줄 모르겠습니다 ㅠ부디 모든문제가 해결되시고행복해지시기 기도합니다🙏🙏,3주 전,오세훈TV,2.3천,56,44
[2030 시민참여유세#6] 청년의 꿈과 희망을 짓밟은 정부·여당! 용서하지 않겠습니다!,2021. 4. 4.,돈이최고,22살 대학생입니다 오늘 오 후보님 유세장에서 연설을 한 20대들을 취업에서 떨어뜨리라는 짐승만도 못한 글을 기사로 봤습니다 더 이상은 못 참겠습니다 굳이 세대갈등 세대간의 전쟁을 원한다면 2030이 힘을 합하고 극악무도하고 오만방자한 586세대와 40대들과 전쟁이라도 치룰수 있습니다 이 글을 보고 국민분열을 조장한다고 생각할수 있지만 애시당초 국민을 분열시킨게 누군지 생각해보면 될겁니다 굳이 내전을 원한다면 얼마든지 해드리죠 자유대한민국과 자본주의를 지키기 위해 뭔들 못하겠습니까,3주 전,오세훈TV,2.3천,56,192
[2030 시민참여유세#6] 청년의 꿈과 희망을 짓밟은 정부·여당! 용서하지 않겠습니다!,2021. 4. 4.,최민이,제발 질서있고공정한나라을 되찾읍시다,3주 전,오세훈TV,2.3천,56,39
[2030 시민참여유세#6] 청년의 꿈과 희망을 짓밟은 정부·여당! 용서하지 않겠습니다!,2021. 4. 4.,홍길동,아들 세대들에게 미안합니다. 힘내시고 오세훈시장이 해주리라 믿습니다.,3주 전,오세훈TV,2.3천,56,35
[2030 시민참여유세#6] 청년의 꿈과 희망을 짓밟은 정부·여당! 용서하지 않겠습니다!,2021. 4. 4.,소은,자랑스러운 우리나라의 청년입니다. 힘내세요. 아주 똑똑한 청년이군요.최~고입니다.,3주 전,오세훈TV,2.3천,56,52
[2030 시민참여유세#6] 청년의 꿈과 희망을 짓밟은 정부·여당! 용서하지 않겠습니다!,2021. 4. 4.,s.m,울지마요..~,3주 전,오세훈TV,2.3천,56,66
[2030 시민참여유세#6] 청년의 꿈과 희망을 짓밟은 정부·여당! 용서하지 않겠습니다!,2021. 4. 4.,HyunJin park,제발 제발 투표 잘합시다!장기 집권만을 위해 국익과 국민은 안중에도 없는 사람들에게 더 이상 나라 맡길수가 없습니다!,3주 전,오세훈TV,2.3천,56,37
[2030 시민참여유세#6] 청년의 꿈과 희망을 짓밟은 정부·여당! 용서하지 않겠습니다!,2021. 4. 4.,김인희,니가    주식을사고    아파트사며     반일  하는동안       누군가는  니 반일때문에  생계가  어려워진다,3주 전(수정됨),오세훈TV,2.3천,56,73
[2030 시민참여유세#6] 청년의 꿈과 희망을 짓밟은 정부·여당! 용서하지 않겠습니다!,2021. 4. 4.,Trump Donald,진짜 나도 경기도민이 되버림..,3주 전,오세훈TV,2.3천,56,49
[2030 시민참여유세#6] 청년의 꿈과 희망을 짓밟은 정부·여당! 용서하지 않겠습니다!,2021. 4. 4.,아비가일,눈물나네요..  그러나 응원합니다!!!,3주 전,오세훈TV,2.3천,56,21
[2030 시민참여유세#6] 청년의 꿈과 희망을 짓밟은 정부·여당! 용서하지 않겠습니다!,2021. 4. 4.,글로리,사랑합니다 힘을 내세요~~,3주 전,오세훈TV,2.3천,56,26
[2030 시민참여유세#6] 청년의 꿈과 희망을 짓밟은 정부·여당! 용서하지 않겠습니다!,2021. 4. 4.,Z i w o n,오세훈시장님이 돌아와야 서울에 희망이 있다.,3주 전,오세훈TV,2.3천,56,41
[2030 시민참여유세#6] 청년의 꿈과 희망을 짓밟은 정부·여당! 용서하지 않겠습니다!,2021. 4. 4.,JS YANG,저도 눈물이 나네요ᆢ힘내세요ᆢ 같이 좋은 세상 만들어야죠! 화이팅!,3주 전,오세훈TV,2.3천,56,42
[2030 시민참여유세#6] 청년의 꿈과 희망을 짓밟은 정부·여당! 용서하지 않겠습니다!,2021. 4. 4.,Bee cosmos,청년들이여!!!!!!! 그대들이 있어 대한민국 미래가 분명히 더욱  밝을 것입니다청년들의 말을 들으면서 느낀것은 옳고 그름을 떠나 절절하다는것에 저또한 목이 메여올뿐입니다,3주 전,오세훈TV,2.3천,56,47
[2030 시민참여유세#6] 청년의 꿈과 희망을 짓밟은 정부·여당! 용서하지 않겠습니다!,2021. 4. 4.,윤실비아,눈물을 흘리면서 이  댓글을 쓰고 있습니다. 저 역시 대학생을 둔 엄마라 더 공감이 가네요 . 청년들에게  희망의 삶을 보장해줘야 하는 게 나라요 정치인데...너무너무 가슴이 아픕니다. 젊은이여 희망을 잃지말고 부디 새롭게 삶을 개척해 나가길 꼭 기원합니다.오세훈후보님 많은 청년들의 말을 귀담아 들어셨죠.. 시장이 되셔서 다 반영해주세요. 오세훈 화이팅!!,3주 전,오세훈TV,2.3천,56,47
[2030 시민참여유세#6] 청년의 꿈과 희망을 짓밟은 정부·여당! 용서하지 않겠습니다!,2021. 4. 4.,ᅳᅳ해피,오세훈시장이 운영하는 최고의도시 서울에서 살고 싶다.,3주 전,오세훈TV,2.3천,56,78
[2030 시민참여유세#6] 청년의 꿈과 희망을 짓밟은 정부·여당! 용서하지 않겠습니다!,2021. 4. 4.,조정옥,너무 가슴 아픕니다~~평범한 부모님의 자식들은 희망이 없이 하루하루 힘들게 살아가는 이현실 ~~세상을 바뀌게 2번 찍어요,2주 전,오세훈TV,2.3천,56,7
[2030 시민참여유세#6] 청년의 꿈과 희망을 짓밟은 정부·여당! 용서하지 않겠습니다!,2021. 4. 4.,송현진,정권교체 무조건 시작은 서울시장부터다!!!,3주 전,오세훈TV,2.3천,56,18
[2030 시민참여유세#6] 청년의 꿈과 희망을 짓밟은 정부·여당! 용서하지 않겠습니다!,2021. 4. 4.,K elly,이번에 알게된사실은 우리 젊은이들이 대견스럽습니다 힘내세요!!,3주 전,오세훈TV,2.3천,56,21
[2030 시민참여유세#6] 청년의 꿈과 희망을 짓밟은 정부·여당! 용서하지 않겠습니다!,2021. 4. 4.,namu5,젊은 청춘들 힘내세요!!!,3주 전,오세훈TV,2.3천,56,29
[2030 시민참여유세#6] 청년의 꿈과 희망을 짓밟은 정부·여당! 용서하지 않겠습니다!,2021. 4. 4.,정원,오세훈 시장님!꼭 이런 청년들에게 꿈과 희망을 주세요~~~화이팅!,3주 전,오세훈TV,2.3천,56,17
[2030 시민참여유세#6] 청년의 꿈과 희망을 짓밟은 정부·여당! 용서하지 않겠습니다!,2021. 4. 4.,조은희,아이고 딱해라젊은이 이제 힘내시고 더좋은나라  더좋은 미래 만들어 주실겁니다그래서 오세훈 후보가 돼야합니다힘내세요~~~~,3주 전,오세훈TV,2.3천,56,38
[2030 시민참여유세#6] 청년의 꿈과 희망을 짓밟은 정부·여당! 용서하지 않겠습니다!,2021. 4. 4.,현하늘,서울 토박이 초-중-고-대 서울에서 나고 자랐어요. 당연히 서울시민으로 살고 싶었죠. 현실은 저 멀리멀리 외곽으로 밀려 살고 있지만 언제든 고향인 서울로 돌아오고 싶네요.활기찬 서울. 세계적인 도시로 만들어 주세요^^,3주 전,오세훈TV,2.3천,56,25
[2030 시민참여유세#6] 청년의 꿈과 희망을 짓밟은 정부·여당! 용서하지 않겠습니다!,2021. 4. 4.,Kim Cynthia,내가 다 울컥하네...그노무 노노재팬 같은 나라 사람들에게도 피해를 주는지도 모르고 도덕성 운운하면서 선동하더니,3주 전,오세훈TV,2.3천,56,15
[2030 시민참여유세#6] 청년의 꿈과 희망을 짓밟은 정부·여당! 용서하지 않겠습니다!,2021. 4. 4.,junghyun park,눈물나네 ㅜㅜ,3주 전,오세훈TV,2.3천,56,43
[2030 시민참여유세#6] 청년의 꿈과 희망을 짓밟은 정부·여당! 용서하지 않겠습니다!,2021. 4. 4.,#NotmyBattlefield,근모형 힘내 ㅠㅠ,3주 전,오세훈TV,2.3천,56,50
[2030 시민참여유세#6] 청년의 꿈과 희망을 짓밟은 정부·여당! 용서하지 않겠습니다!,2021. 4. 4.,송애숙,아유 청년 힘내요 눈물나내요,3주 전,오세훈TV,2.3천,56,33
[2030 시민참여유세#6] 청년의 꿈과 희망을 짓밟은 정부·여당! 용서하지 않겠습니다!,2021. 4. 4.,최수정,모든 청년들! 20~30대 힘주십시요!,3주 전,오세훈TV,2.3천,56,20
[2030 시민참여유세#6] 청년의 꿈과 희망을 짓밟은 정부·여당! 용서하지 않겠습니다!,2021. 4. 4.,오마갓,볼때마다 눈물..  청년 힘내요 좋은날 올거예요,3주 전,오세훈TV,2.3천,56,49
[2030 시민참여유세#6] 청년의 꿈과 희망을 짓밟은 정부·여당! 용서하지 않겠습니다!,2021. 4. 4.,join so,"내가 ""오세훈"" 이다!!!우리가  ""오세훈"" 이다!!!",3주 전(수정됨),오세훈TV,2.3천,56,31
[2030 시민참여유세#6] 청년의 꿈과 희망을 짓밟은 정부·여당! 용서하지 않겠습니다!,2021. 4. 4.,박또순,눈물난다어찌나우리나라 살려주세요여긴 지방 입니다,2주 전,오세훈TV,2.3천,56,1
[2030 시민참여유세#6] 청년의 꿈과 희망을 짓밟은 정부·여당! 용서하지 않겠습니다!,2021. 4. 4.,grace kim,아 청년말에 나도 눈물나고 분노가 납니다 이 악하고 무능하고 위선덩어리 정권을 빨리 무너뜨려야 합니다,1주 전,오세훈TV,2.3천,56,4
[2030 시민참여유세#6] 청년의 꿈과 희망을 짓밟은 정부·여당! 용서하지 않겠습니다!,2021. 4. 4.,Good Man,보는데 눈물이 나네요.. 힘내세요..,2주 전,오세훈TV,2.3천,56,3
[2030 시민참여유세#6] 청년의 꿈과 희망을 짓밟은 정부·여당! 용서하지 않겠습니다!,2021. 4. 4.,미합중국,우리가 오세훈이다-!,3주 전,오세훈TV,2.3천,56,14
[2030 시민참여유세#6] 청년의 꿈과 희망을 짓밟은 정부·여당! 용서하지 않겠습니다!,2021. 4. 4.,황계성,문재인 보고있나? 저 청년의 절규를!,3주 전,오세훈TV,2.3천,56,19
[2030 시민참여유세#6] 청년의 꿈과 희망을 짓밟은 정부·여당! 용서하지 않겠습니다!,2021. 4. 4.,이순신,우리동생 뻘인데 가슴이 아프네 ㅠㅠㅠㅠ,3주 전,오세훈TV,2.3천,56,23
[2030 시민참여유세#6] 청년의 꿈과 희망을 짓밟은 정부·여당! 용서하지 않겠습니다!,2021. 4. 4.,이코코,오세훈화이팅,3주 전,오세훈TV,2.3천,56,32
[2030 시민참여유세#6] 청년의 꿈과 희망을 짓밟은 정부·여당! 용서하지 않겠습니다!,2021. 4. 4.,sa l,청년들이   많이 돌아 섰군요그래도 대깨문들  정신차리세요이번에   선거 잘해야  젊은이들에게  미래가 있습니다오세훈 서울시장 2 번을 투표해서✌✌✌  서울도 살리고정권심판으로   대한민국 살립시다,3주 전,오세훈TV,2.3천,56,21
[2030 시민참여유세#6] 청년의 꿈과 희망을 짓밟은 정부·여당! 용서하지 않겠습니다!,2021. 4. 4.,"자유,새벽이슬",제발요 직을 간다는거는두번다시는하지말아 주세요자유민주주의 대한민국을 🇰🇷 위하여 반중친미 국익우선 꼭 부탁드립니다 🙏,3주 전,오세훈TV,2.3천,56,12
[2030 시민참여유세#6] 청년의 꿈과 희망을 짓밟은 정부·여당! 용서하지 않겠습니다!,2021. 4. 4.,ㅇㅇㅇ,전세계인이  다시 오고 싶은 서울의 틀을 만들어준 오세훈 시장님!이번에도 당선 되시어~청년의 꿈 짓밟히지 않는 든든한 국민의 미래를 여는 시장님 되어 주세요~👍,3주 전,오세훈TV,2.3천,56,12
[2030 시민참여유세#6] 청년의 꿈과 희망을 짓밟은 정부·여당! 용서하지 않겠습니다!,2021. 4. 4.,커피,🥺🥺🥺🥺🥺🥺 힘내세요 ㅠ 저도 눈물이 나네요🥺🥺🥺🥺🥺,3주 전,오세훈TV,2.3천,56,27
[2030 시민참여유세#6] 청년의 꿈과 희망을 짓밟은 정부·여당! 용서하지 않겠습니다!,2021. 4. 4.,ᅳᅳ해피,서울시민 되고싶다.,3주 전,오세훈TV,2.3천,56,8
[2030 시민참여유세#6] 청년의 꿈과 희망을 짓밟은 정부·여당! 용서하지 않겠습니다!,2021. 4. 4.,김선희,대한민국 이끌 청년들 이왠말인가 눈물이납니다 청년들 이여 화이팅.,3주 전,오세훈TV,2.3천,56,18
[2030 시민참여유세#6] 청년의 꿈과 희망을 짓밟은 정부·여당! 용서하지 않겠습니다!,2021. 4. 4.,주영광,제발 부정선거 막으세요사전선거함 지키세요 제발.,3주 전(수정됨),오세훈TV,2.3천,56,9
[2030 시민참여유세#6] 청년의 꿈과 희망을 짓밟은 정부·여당! 용서하지 않겠습니다!,2021. 4. 4.,lakey Jun,어우씨 ...안타깝네..,3주 전,오세훈TV,2.3천,56,5
[2030 시민참여유세#6] 청년의 꿈과 희망을 짓밟은 정부·여당! 용서하지 않겠습니다!,2021. 4. 4.,반얀트리,🤠오세훈 후보 다시 🏃🏃뛰는 🇰🇷대한민국의 💖심장 🌈서울을 🙋🙆청년들이 🛫도약할 🛣발판으로 ✌반드시 🏗만들어줄 🌟것입니다🌞.,3주 전(수정됨),오세훈TV,2.3천,56,11
[2030 시민참여유세#6] 청년의 꿈과 희망을 짓밟은 정부·여당! 용서하지 않겠습니다!,2021. 4. 4.,알송달송,힘내자~~~청년들아~~!맘다잡고 세상 바로 잡자구요~!,3주 전,오세훈TV,2.3천,56,12
[2030 시민참여유세#6] 청년의 꿈과 희망을 짓밟은 정부·여당! 용서하지 않겠습니다!,2021. 4. 4.,김지혜,잘 되실겁니다! 마음으로 응원합니다 🙏🏻,3주 전,오세훈TV,2.3천,56,5
[2030 시민참여유세#6] 청년의 꿈과 희망을 짓밟은 정부·여당! 용서하지 않겠습니다!,2021. 4. 4.,최기 원,저 청년에게 우선 위로의 말과 절대 공감 합니다,3주 전,오세훈TV,2.3천,56,4
[2030 시민참여유세#6] 청년의 꿈과 희망을 짓밟은 정부·여당! 용서하지 않겠습니다!,2021. 4. 4.,ᄋᄋ,"유니클로 티 안돼요, 렉서스 돼요 삼성 대기업 나빠요, 일본항공 투자해보아요야스쿠니 신사 나빠요, 야스쿠니 신사뷰 아파트 좋아요",3주 전,오세훈TV,2.3천,56,53
[2030 시민참여유세#6] 청년의 꿈과 희망을 짓밟은 정부·여당! 용서하지 않겠습니다!,2021. 4. 4.,코스모스,오세훈 서울시장 화이팅,3주 전,오세훈TV,2.3천,56,7
[2030 시민참여유세#6] 청년의 꿈과 희망을 짓밟은 정부·여당! 용서하지 않겠습니다!,2021. 4. 4.,김애숙,"청년들의 외침이 하루빨리 잘사는 나라가 되야 합니다,청년들의 마음 고생이얼마나 많으세요,",2주 전,오세훈TV,2.3천,56,2
[2030 시민참여유세#6] 청년의 꿈과 희망을 짓밟은 정부·여당! 용서하지 않겠습니다!,2021. 4. 4.,JAE SOO KIM,진짜 울분이 느껴진다,2주 전,오세훈TV,2.3천,56,1
[2030 시민참여유세#6] 청년의 꿈과 희망을 짓밟은 정부·여당! 용서하지 않겠습니다!,2021. 4. 4.,들꽃,젊은 청년들 돌아와줘 정말 고맙고 잘했습니다👏👏👏,2주 전,오세훈TV,2.3천,56,1
[2030 시민참여유세#6] 청년의 꿈과 희망을 짓밟은 정부·여당! 용서하지 않겠습니다!,2021. 4. 4.,윤혜정,거의 모든 국민이 죽어가고 있습니다ㅠ저도 살기힘든 와중에 대출규제로 죽지 못해 삽니다일어설 수가 없어요ㅠ,2주 전,오세훈TV,2.3천,56,1
[2030 시민참여유세#6] 청년의 꿈과 희망을 짓밟은 정부·여당! 용서하지 않겠습니다!,2021. 4. 4.,K Hello,심판합시다 !!!!!!!!,3주 전,오세훈TV,2.3천,56,3
[2030 시민참여유세#6] 청년의 꿈과 희망을 짓밟은 정부·여당! 용서하지 않겠습니다!,2021. 4. 4.,보수우파,저런 애국청년이있어서 대한민국의 희망이있습니다 화이팅!!!,3주 전,오세훈TV,2.3천,56,2
[2030 시민참여유세#6] 청년의 꿈과 희망을 짓밟은 정부·여당! 용서하지 않겠습니다!,2021. 4. 4.,Benjamin K,힘내세요 !,3주 전,오세훈TV,2.3천,56,3
[2030 시민참여유세#6] 청년의 꿈과 희망을 짓밟은 정부·여당! 용서하지 않겠습니다!,2021. 4. 4.,의信,눈물 흘리는 청년들 ㅠ넘넘 가슴 아픕니다 ㅠ오세훈 시장님?제발 우리 젊은 청년들이며 등등 단순히 서울시장으로서만이 아니라 대한민국을 위해 일해 주십시요!!믿습니다🙏,2주 전,오세훈TV,2.3천,56,1
[2030 시민참여유세#6] 청년의 꿈과 희망을 짓밟은 정부·여당! 용서하지 않겠습니다!,2021. 4. 4.,judy ryu,그래 아무리 일본이 싫어도 롯데 같은 기업 자르면 거기 다니는 사람들과 가족들은 가장을 잃는 거임,2주 전,오세훈TV,2.3천,56,4
[2030 시민참여유세#6] 청년의 꿈과 희망을 짓밟은 정부·여당! 용서하지 않겠습니다!,2021. 4. 4.,이은영,오세훈 시장님 화이팅!!!,3주 전,오세훈TV,2.3천,56,6
[2030 시민참여유세#6] 청년의 꿈과 희망을 짓밟은 정부·여당! 용서하지 않겠습니다!,2021. 4. 4.,SANGHUN OH,열심히일하다건강을잃은게맘아파요,3주 전,오세훈TV,2.3천,56,5
[2030 시민참여유세#6] 청년의 꿈과 희망을 짓밟은 정부·여당! 용서하지 않겠습니다!,2021. 4. 4.,이한울,저도 일자리 구하는 입장이라 눈물만 나네요... 20대분들 힘냅시다 우린 할수있습니다.,2주 전,오세훈TV,2.3천,56,1
[2030 시민참여유세#6] 청년의 꿈과 희망을 짓밟은 정부·여당! 용서하지 않겠습니다!,2021. 4. 4.,Grazia,눈물나네요... 힘내시고 우리 연합하여 승리합시다!!!,2주 전,오세훈TV,2.3천,56,1
[2030 시민참여유세#6] 청년의 꿈과 희망을 짓밟은 정부·여당! 용서하지 않겠습니다!,2021. 4. 4.,KD A,10번 보는데 또 눈물난다,2주 전,오세훈TV,2.3천,56,1
[2030 시민참여유세#6] 청년의 꿈과 희망을 짓밟은 정부·여당! 용서하지 않겠습니다!,2021. 4. 4.,Jake,우는모습에 울컥함 ㅜㅜ,2주 전,오세훈TV,2.3천,56,1
[2030 시민참여유세#6] 청년의 꿈과 희망을 짓밟은 정부·여당! 용서하지 않겠습니다!,2021. 4. 4.,쁘라나,우리 아이들 눈에서피눈물 쏟게 하는 저것들열배 백배 생지옥에 빠지길,3주 전,오세훈TV,2.3천,56,25
[2030 시민참여유세#6] 청년의 꿈과 희망을 짓밟은 정부·여당! 용서하지 않겠습니다!,2021. 4. 4.,러시아제국,우리는 버려졌어 ㅠㅠ,3주 전,오세훈TV,2.3천,56,1
[2030 시민참여유세#6] 청년의 꿈과 희망을 짓밟은 정부·여당! 용서하지 않겠습니다!,2021. 4. 4.,정도하,이번에도 부정선거 얘기가 있는데 걱정입니다 저들은 나라나 국민은 안중에도 없는것 같고 어떡해서든지  기득권만 유지할려고 하는 나쁜 집단이라는 생각입니다,3주 전,오세훈TV,2.3천,56,2
