Title,Date,ID,Comment,Comment_date,Channel,Like,Dislike,Comment_like
[2030 시민참여유세#6] 청년의 꿈과 희망을 짓밟은 정부·여당! 용서하지 않겠습니다!,2021. 4. 4.,이에드몬드,이노무 좌파정권 이가 갈린다,2주 전,오세훈TV,2.3천,56,2
[2030 시민참여유세#6] 청년의 꿈과 희망을 짓밟은 정부·여당! 용서하지 않겠습니다!,2021. 4. 4.,부산촌놈tv,문재인정부야 우리가 무슨 거창한걸요구하더나남녀할당제에걸려 여성보다실력있던남성이떨어지고은행에서는남자직원을더뽑기위해더뛰어난여성채용자의점수를 깍아여성지원자를떨어뜨리고 그냥기회의 평등을 요구하는거 아니냐?,1주 전,오세훈TV,2.3천,56,1
[2030 시민참여유세#6] 청년의 꿈과 희망을 짓밟은 정부·여당! 용서하지 않겠습니다!,2021. 4. 4.,w go,지금 윤지선이 20대30대 남자들 죽일려고 하고 있고 유튜버 보겸을 아에 묻을려고 합니다 20대30대가 없이는 나라가 흔들릴수 있습니다 수도인 서울을 반드시 수복을 시작으로 반격을 해서 20대30대 남자가 살수 있는 나라를 그 어린 학생들이 살수 있는 나라를 만들어야 합니다,3주 전,오세훈TV,2.3천,56,1
[2030 시민참여유세#6] 청년의 꿈과 희망을 짓밟은 정부·여당! 용서하지 않겠습니다!,2021. 4. 4.,이옹굳,한번도 경험해보지 못한나라를 만든 문재앙,3주 전,오세훈TV,2.3천,56,8
[2030 시민참여유세#6] 청년의 꿈과 희망을 짓밟은 정부·여당! 용서하지 않겠습니다!,2021. 4. 4.,전천후,청년들 알바 열심히 하시네요화이팅,3주 전,오세훈TV,2.3천,56,2
[2030 시민참여유세#6] 청년의 꿈과 희망을 짓밟은 정부·여당! 용서하지 않겠습니다!,2021. 4. 4.,유정곤,반일파시짐찐왜구 박영선,2주 전,오세훈TV,2.3천,56,0
[2030 시민참여유세#6] 청년의 꿈과 희망을 짓밟은 정부·여당! 용서하지 않겠습니다!,2021. 4. 4.,야호,페미들때문에 못살겠다!!!!!!!! 페미민주는 못찍겠다.. 남자와 여자에게 공평한 기회를 달라!!!!!!!!!,3주 전,오세훈TV,2.3천,56,1
[2030 시민참여유세#6] 청년의 꿈과 희망을 짓밟은 정부·여당! 용서하지 않겠습니다!,2021. 4. 4.,홍길동,민주당 문재인 나쯘놈 북한에 3000억 건물지어주고 감성정치하고 돈날린 양ㅇ아치ㅉㅉ,1주 전,오세훈TV,2.3천,56,1
[2030 시민참여유세#6] 청년의 꿈과 희망을 짓밟은 정부·여당! 용서하지 않겠습니다!,2021. 4. 4.,풍림화산,눈물나네 폭정이란 단어를 잘모르네. 오세훈이 당선되면 일본하고 좋아져서 일본에서 일하는걸 원하시니 원하는데로 하세요,3주 전(수정됨),오세훈TV,2.3천,56,1
[2030 시민참여유세#6] 청년의 꿈과 희망을 짓밟은 정부·여당! 용서하지 않겠습니다!,2021. 4. 4.,군가산점부활하라,제발 부탁인데 군복무 가산점 부활시켜주세요. 청년 예비역 남성들 군대가서 2년간 개고생 하고 왔는데도 합당한 보상도 없이 사회에서 차별 받으면서 취업난 속에서 폐미니즘 정책 때문에 역차별 받으면서 울부 짖고 고생하고 있습니다. 여기다가 박원순 아들 병역기피와 추미애 아들 황제군복무 논란으로 엄청난 박탈감과 회의감을 느끼고 있어요. 군대 다녀온 예비역 청년남성들 군가산점 반드시 필요합니다. 제발 국민의 힘이 신경써서 군가산점 다시 부활되도록 힘좀 써주세요. ㅜㅜ 제발 꼭이요,3주 전(수정됨),오세훈TV,2.3천,56,2
[2030 시민참여유세#6] 청년의 꿈과 희망을 짓밟은 정부·여당! 용서하지 않겠습니다!,2021. 4. 4.,UN,반일프레임 진짜 지긋지긋하다. 힘내세요! 우리의 적은 북한입니다. 일본으로 물타기하지마세요!!,3주 전,오세훈TV,2.3천,56,0
[2030 시민참여유세#6] 청년의 꿈과 희망을 짓밟은 정부·여당! 용서하지 않겠습니다!,2021. 4. 4.,james john,"참 이해가 안 되는 게, 반일 프레임은 박근혜 정부가 일본이랑 위안부 문제에 관해 비가역적 합의를 했기에 국민들이 열 받아서 한 거 아니야? 결국 원인 제공자는 박근혜인데 왜 애먼 문재인을 욕하지?? 그리고 오세훈이 서울시장 되면 사회적 약자인 청년들한테 잘 해줄 거라고 생각하나???",3주 전,오세훈TV,2.3천,56,0
[2030 시민참여유세#6] 청년의 꿈과 희망을 짓밟은 정부·여당! 용서하지 않겠습니다!,2021. 4. 4.,장순호,눈이 안보이는데 스마트폰은 잘만 보내. 일본 그리 좋으면 일본가서 살아라,3주 전(수정됨),오세훈TV,2.3천,56,0
[2030 시민참여유세#6] 청년의 꿈과 희망을 짓밟은 정부·여당! 용서하지 않겠습니다!,2021. 4. 4.,geek wu,근모야 정치탓하지말아라. 니 인생 니가 사는거다 ㅋㅋ,3주 전,오세훈TV,2.3천,56,0
[2030 시민참여유세#6] 청년의 꿈과 희망을 짓밟은 정부·여당! 용서하지 않겠습니다!,2021. 4. 4.,Lee Stan,아침마다 똥먹는사람 좋아요,3주 전(수정됨),오세훈TV,2.3천,56,6
[2030 시민참여유세#6] 청년의 꿈과 희망을 짓밟은 정부·여당! 용서하지 않겠습니다!,2021. 4. 4.,들산내,"이 정부 아니었으면 지금 그 자리에 서 있지도 못했다 살아있음에 감사하세요 저런 도둑부자 위선자에게 속는 어리석은 젊은이, 아무리 그래도 국암당 따까리 노릇은 아니지",2주 전(수정됨),오세훈TV,2.3천,56,1
[2030 시민참여유세#6] 청년의 꿈과 희망을 짓밟은 정부·여당! 용서하지 않겠습니다!,2021. 4. 4.,수성못 장산범,민주당 = 공산당,3주 전,오세훈TV,2.3천,56,4
[2030 시민참여유세#6] 청년의 꿈과 희망을 짓밟은 정부·여당! 용서하지 않겠습니다!,2021. 4. 4.,김민우,애들 앞세워서 뭐하는짓이냐 진짜.. 일자리못찾는건 니탓이지 정부탓이냐 억울하면 공무원시험합격해라.. 정신나간집단어이구,3주 전,오세훈TV,2.3천,56,0
[2030 시민참여유세#6] 청년의 꿈과 희망을 짓밟은 정부·여당! 용서하지 않겠습니다!,2021. 4. 4.,장보영,벌써 투표용지다빼돌려서 다태우고 딴투표 1번찍은거 다 바꿔치기 벌써 다한듯해요  백날유세 하면뭐합니까요  사전투표 몰표나오면  우파사람들이 투표안할걸로착각하지마시고 부정선거 한걸로아세요 사전투표 나중에4월7일날보세요 민주당몰표 나올겁니다 제발정신좀 차리세요,3주 전,오세훈TV,2.3천,56,0
[2030 시민참여유세#6] 청년의 꿈과 희망을 짓밟은 정부·여당! 용서하지 않겠습니다!,2021. 4. 4.,아드리안멀,ㅍㅎㅎㅎㅎㅎㅎㅎㅎㅎ야너  영화배우 해도 되겠다? ㅎㅎㅎㅎㅎ  나도 한때는  이명박 밀어줬었다.  눈에 보이는것이 전부는 아니란다?,3주 전,오세훈TV,2.3천,56,0
[2030 시민참여유세#6] 청년의 꿈과 희망을 짓밟은 정부·여당! 용서하지 않겠습니다!,2021. 4. 4.,james john,"""서울시민이 되고 싶었지만 어쩔수없이 경기도민이 된""????서울시민이 못 되고 2등 경기도 시민이 되어 패배의식이 듭니까? 말씀 참 이상하게 하시네. 경기도민들이 싫어하시겠다 ㅋㅋ",3주 전,오세훈TV,2.3천,56,0
[2030 시민참여유세#6] 청년의 꿈과 희망을 짓밟은 정부·여당! 용서하지 않겠습니다!,2021. 4. 4.,양현민,가지가지 한다 ㅋ,3주 전,오세훈TV,2.3천,56,1
[2030 시민참여유세#6] 청년의 꿈과 희망을 짓밟은 정부·여당! 용서하지 않겠습니다!,2021. 4. 4.,Seokoo Lee,어린이급식도배려못하는서울시장해고된사람이국민에게배려하겟는가 나라에돈이없는것이아니라도둑늠이많아요 허경영말씀,3주 전(수정됨),오세훈TV,2.3천,56,0
[2030 시민참여유세#6] 청년의 꿈과 희망을 짓밟은 정부·여당! 용서하지 않겠습니다!,2021. 4. 4.,샷건,반일 운동때문에 ???  일본에서 쫒겨났다고 ? 뭔  처음 듣는 소리를 ....남탓을  .. 내로남불 입니다,2주 전,오세훈TV,2.3천,56,1
[2030 시민참여유세#6] 청년의 꿈과 희망을 짓밟은 정부·여당! 용서하지 않겠습니다!,2021. 4. 4.,이순신,너의 능력을 탓해라.. 그리고 너의 주제에 맞게 직장을 구해.. 기준치를 낮춰라.. 내 주위에 청년들 직장에서 월 350받으면서 공부하고 있다..그리고 너의 눈이 정부탓이냐?? 너의 눈 유전일 수도 있고 여러가지 너의 잘못일 이유도 있다.. 누구 탓하기전에 네 자신을 알라라도 말해주고 싶다.남 탓하지마라,2주 전,오세훈TV,2.3천,56,0
